No.     Time           Source                Destination           Protocol Length Info
      1 0.000000000    31.12.68.207          192.168.1.4           HTTP     1514   Continuation or non-HTTP traffic

Frame 1: 1514 bytes on wire (12112 bits), 1514 bytes captured (12112 bits) on interface 0
Ethernet II, Src: Netgear_3b:4d:d2 (4c:60:de:3b:4d:d2), Dst: IntelCor_50:de:04 (00:23:15:50:de:04)
Internet Protocol Version 4, Src: 31.12.68.207 (31.12.68.207), Dst: 192.168.1.4 (192.168.1.4)
Transmission Control Protocol, Src Port: http (80), Dst Port: 49656 (49656), Seq: 1, Ack: 1, Len: 1460
Hypertext Transfer Protocol

No.     Time           Source                Destination           Protocol Length Info
      2 0.000051000    192.168.1.4           31.12.68.207          TCP      54     49656 > http [ACK] Seq=1 Ack=1461 Win=778 Len=0

Frame 2: 54 bytes on wire (432 bits), 54 bytes captured (432 bits) on interface 0
Ethernet II, Src: IntelCor_50:de:04 (00:23:15:50:de:04), Dst: Netgear_3b:4d:d2 (4c:60:de:3b:4d:d2)
Internet Protocol Version 4, Src: 192.168.1.4 (192.168.1.4), Dst: 31.12.68.207 (31.12.68.207)
Transmission Control Protocol, Src Port: 49656 (49656), Dst Port: http (80), Seq: 1, Ack: 1461, Len: 0

No.     Time           Source                Destination           Protocol Length Info
      3 0.000379000    31.12.68.207          192.168.1.4           HTTP     1514   Continuation or non-HTTP traffic

Frame 3: 1514 bytes on wire (12112 bits), 1514 bytes captured (12112 bits) on interface 0
Ethernet II, Src: Netgear_3b:4d:d2 (4c:60:de:3b:4d:d2), Dst: IntelCor_50:de:04 (00:23:15:50:de:04)
Internet Protocol Version 4, Src: 31.12.68.207 (31.12.68.207), Dst: 192.168.1.4 (192.168.1.4)
Transmission Control Protocol, Src Port: http (80), Dst Port: 49656 (49656), Seq: 1461, Ack: 1, Len: 1460
Hypertext Transfer Protocol

No.     Time           Source                Destination           Protocol Length Info
      4 0.097760000    31.12.68.207          192.168.1.4           HTTP     896    Continuation or non-HTTP traffic

Frame 4: 896 bytes on wire (7168 bits), 896 bytes captured (7168 bits) on interface 0
Ethernet II, Src: Netgear_3b:4d:d2 (4c:60:de:3b:4d:d2), Dst: IntelCor_50:de:04 (00:23:15:50:de:04)
Internet Protocol Version 4, Src: 31.12.68.207 (31.12.68.207), Dst: 192.168.1.4 (192.168.1.4)
Transmission Control Protocol, Src Port: http (80), Dst Port: 49656 (49656), Seq: 2921, Ack: 1, Len: 842
Hypertext Transfer Protocol

No.     Time           Source                Destination           Protocol Length Info
      5 0.097815000    192.168.1.4           31.12.68.207          TCP      54     49656 > http [ACK] Seq=1 Ack=3763 Win=769 Len=0

Frame 5: 54 bytes on wire (432 bits), 54 bytes captured (432 bits) on interface 0
Ethernet II, Src: IntelCor_50:de:04 (00:23:15:50:de:04), Dst: Netgear_3b:4d:d2 (4c:60:de:3b:4d:d2)
Internet Protocol Version 4, Src: 192.168.1.4 (192.168.1.4), Dst: 31.12.68.207 (31.12.68.207)
Transmission Control Protocol, Src Port: 49656 (49656), Dst Port: http (80), Seq: 1, Ack: 3763, Len: 0

No.     Time           Source                Destination           Protocol Length Info
      6 0.185555000    31.12.68.207          192.168.1.4           HTTP     1514   Continuation or non-HTTP traffic

Frame 6: 1514 bytes on wire (12112 bits), 1514 bytes captured (12112 bits) on interface 0
Ethernet II, Src: Netgear_3b:4d:d2 (4c:60:de:3b:4d:d2), Dst: IntelCor_50:de:04 (00:23:15:50:de:04)
Internet Protocol Version 4, Src: 31.12.68.207 (31.12.68.207), Dst: 192.168.1.4 (192.168.1.4)
Transmission Control Protocol, Src Port: http (80), Dst Port: 49656 (49656), Seq: 3763, Ack: 1, Len: 1460
Hypertext Transfer Protocol

No.     Time           Source                Destination           Protocol Length Info
      7 0.195790000    31.12.68.207          192.168.1.4           HTTP     1102   Continuation or non-HTTP traffic

Frame 7: 1102 bytes on wire (8816 bits), 1102 bytes captured (8816 bits) on interface 0
Ethernet II, Src: Netgear_3b:4d:d2 (4c:60:de:3b:4d:d2), Dst: IntelCor_50:de:04 (00:23:15:50:de:04)
Internet Protocol Version 4, Src: 31.12.68.207 (31.12.68.207), Dst: 192.168.1.4 (192.168.1.4)
Transmission Control Protocol, Src Port: http (80), Dst Port: 49656 (49656), Seq: 5223, Ack: 1, Len: 1048
Hypertext Transfer Protocol

No.     Time           Source                Destination           Protocol Length Info
      8 0.195828000    192.168.1.4           31.12.68.207          TCP      54     49656 > http [ACK] Seq=1 Ack=6271 Win=760 Len=0

Frame 8: 54 bytes on wire (432 bits), 54 bytes captured (432 bits) on interface 0
Ethernet II, Src: IntelCor_50:de:04 (00:23:15:50:de:04), Dst: Netgear_3b:4d:d2 (4c:60:de:3b:4d:d2)
Internet Protocol Version 4, Src: 192.168.1.4 (192.168.1.4), Dst: 31.12.68.207 (31.12.68.207)
Transmission Control Protocol, Src Port: 49656 (49656), Dst Port: http (80), Seq: 1, Ack: 6271, Len: 0

No.     Time           Source                Destination           Protocol Length Info
      9 0.383864000    192.168.1.4           31.12.68.207          TCP      54     [TCP Window Update] 49656 > http [ACK] Seq=1 Ack=6271 Win=1111 Len=0

Frame 9: 54 bytes on wire (432 bits), 54 bytes captured (432 bits) on interface 0
Ethernet II, Src: IntelCor_50:de:04 (00:23:15:50:de:04), Dst: Netgear_3b:4d:d2 (4c:60:de:3b:4d:d2)
Internet Protocol Version 4, Src: 192.168.1.4 (192.168.1.4), Dst: 31.12.68.207 (31.12.68.207)
Transmission Control Protocol, Src Port: 49656 (49656), Dst Port: http (80), Seq: 1, Ack: 6271, Len: 0

No.     Time           Source                Destination           Protocol Length Info
     10 0.394369000    31.12.68.207          192.168.1.4           HTTP     1308   Continuation or non-HTTP traffic

Frame 10: 1308 bytes on wire (10464 bits), 1308 bytes captured (10464 bits) on interface 0
Ethernet II, Src: Netgear_3b:4d:d2 (4c:60:de:3b:4d:d2), Dst: IntelCor_50:de:04 (00:23:15:50:de:04)
Internet Protocol Version 4, Src: 31.12.68.207 (31.12.68.207), Dst: 192.168.1.4 (192.168.1.4)
Transmission Control Protocol, Src Port: http (80), Dst Port: 49656 (49656), Seq: 6271, Ack: 1, Len: 1254
Hypertext Transfer Protocol

No.     Time           Source                Destination           Protocol Length Info
     11 0.490592000    31.12.68.207          192.168.1.4           HTTP     1514   Continuation or non-HTTP traffic

Frame 11: 1514 bytes on wire (12112 bits), 1514 bytes captured (12112 bits) on interface 0
Ethernet II, Src: Netgear_3b:4d:d2 (4c:60:de:3b:4d:d2), Dst: IntelCor_50:de:04 (00:23:15:50:de:04)
Internet Protocol Version 4, Src: 31.12.68.207 (31.12.68.207), Dst: 192.168.1.4 (192.168.1.4)
Transmission Control Protocol, Src Port: http (80), Dst Port: 49656 (49656), Seq: 7525, Ack: 1, Len: 1460
Hypertext Transfer Protocol

No.     Time           Source                Destination           Protocol Length Info
     12 0.490645000    192.168.1.4           31.12.68.207          TCP      54     49656 > http [ACK] Seq=1 Ack=8985 Win=1100 Len=0

Frame 12: 54 bytes on wire (432 bits), 54 bytes captured (432 bits) on interface 0
Ethernet II, Src: IntelCor_50:de:04 (00:23:15:50:de:04), Dst: Netgear_3b:4d:d2 (4c:60:de:3b:4d:d2)
Internet Protocol Version 4, Src: 192.168.1.4 (192.168.1.4), Dst: 31.12.68.207 (31.12.68.207)
Transmission Control Protocol, Src Port: 49656 (49656), Dst Port: http (80), Seq: 1, Ack: 8985, Len: 0

No.     Time           Source                Destination           Protocol Length Info
     13 0.491669000    31.12.68.207          192.168.1.4           HTTP     1514   Continuation or non-HTTP traffic

Frame 13: 1514 bytes on wire (12112 bits), 1514 bytes captured (12112 bits) on interface 0
Ethernet II, Src: Netgear_3b:4d:d2 (4c:60:de:3b:4d:d2), Dst: IntelCor_50:de:04 (00:23:15:50:de:04)
Internet Protocol Version 4, Src: 31.12.68.207 (31.12.68.207), Dst: 192.168.1.4 (192.168.1.4)
Transmission Control Protocol, Src Port: http (80), Dst Port: 49656 (49656), Seq: 8985, Ack: 1, Len: 1460
Hypertext Transfer Protocol

No.     Time           Source                Destination           Protocol Length Info
     14 0.589774000    31.12.68.207          192.168.1.4           HTTP     896    Continuation or non-HTTP traffic

Frame 14: 896 bytes on wire (7168 bits), 896 bytes captured (7168 bits) on interface 0
Ethernet II, Src: Netgear_3b:4d:d2 (4c:60:de:3b:4d:d2), Dst: IntelCor_50:de:04 (00:23:15:50:de:04)
Internet Protocol Version 4, Src: 31.12.68.207 (31.12.68.207), Dst: 192.168.1.4 (192.168.1.4)
Transmission Control Protocol, Src Port: http (80), Dst Port: 49656 (49656), Seq: 10445, Ack: 1, Len: 842
Hypertext Transfer Protocol

No.     Time           Source                Destination           Protocol Length Info
     15 0.589821000    192.168.1.4           31.12.68.207          TCP      54     49656 > http [ACK] Seq=1 Ack=11287 Win=1091 Len=0

Frame 15: 54 bytes on wire (432 bits), 54 bytes captured (432 bits) on interface 0
Ethernet II, Src: IntelCor_50:de:04 (00:23:15:50:de:04), Dst: Netgear_3b:4d:d2 (4c:60:de:3b:4d:d2)
Internet Protocol Version 4, Src: 192.168.1.4 (192.168.1.4), Dst: 31.12.68.207 (31.12.68.207)
Transmission Control Protocol, Src Port: 49656 (49656), Dst Port: http (80), Seq: 1, Ack: 11287, Len: 0

No.     Time           Source                Destination           Protocol Length Info
     16 0.674744000    31.12.68.207          192.168.1.4           HTTP     1514   Continuation or non-HTTP traffic

Frame 16: 1514 bytes on wire (12112 bits), 1514 bytes captured (12112 bits) on interface 0
Ethernet II, Src: Netgear_3b:4d:d2 (4c:60:de:3b:4d:d2), Dst: IntelCor_50:de:04 (00:23:15:50:de:04)
Internet Protocol Version 4, Src: 31.12.68.207 (31.12.68.207), Dst: 192.168.1.4 (192.168.1.4)
Transmission Control Protocol, Src Port: http (80), Dst Port: 49656 (49656), Seq: 11287, Ack: 1, Len: 1460
Hypertext Transfer Protocol

No.     Time           Source                Destination           Protocol Length Info
     17 0.687644000    31.12.68.207          192.168.1.4           HTTP     1102   Continuation or non-HTTP traffic

Frame 17: 1102 bytes on wire (8816 bits), 1102 bytes captured (8816 bits) on interface 0
Ethernet II, Src: Netgear_3b:4d:d2 (4c:60:de:3b:4d:d2), Dst: IntelCor_50:de:04 (00:23:15:50:de:04)
Internet Protocol Version 4, Src: 31.12.68.207 (31.12.68.207), Dst: 192.168.1.4 (192.168.1.4)
Transmission Control Protocol, Src Port: http (80), Dst Port: 49656 (49656), Seq: 12747, Ack: 1, Len: 1048
Hypertext Transfer Protocol

No.     Time           Source                Destination           Protocol Length Info
     18 0.687681000    192.168.1.4           31.12.68.207          TCP      54     49656 > http [ACK] Seq=1 Ack=13795 Win=1081 Len=0

Frame 18: 54 bytes on wire (432 bits), 54 bytes captured (432 bits) on interface 0
Ethernet II, Src: IntelCor_50:de:04 (00:23:15:50:de:04), Dst: Netgear_3b:4d:d2 (4c:60:de:3b:4d:d2)
Internet Protocol Version 4, Src: 192.168.1.4 (192.168.1.4), Dst: 31.12.68.207 (31.12.68.207)
Transmission Control Protocol, Src Port: 49656 (49656), Dst Port: http (80), Seq: 1, Ack: 13795, Len: 0

No.     Time           Source                Destination           Protocol Length Info
     19 0.776010000    31.12.68.207          192.168.1.4           HTTP     1514   Continuation or non-HTTP traffic

Frame 19: 1514 bytes on wire (12112 bits), 1514 bytes captured (12112 bits) on interface 0
Ethernet II, Src: Netgear_3b:4d:d2 (4c:60:de:3b:4d:d2), Dst: IntelCor_50:de:04 (00:23:15:50:de:04)
Internet Protocol Version 4, Src: 31.12.68.207 (31.12.68.207), Dst: 192.168.1.4 (192.168.1.4)
Transmission Control Protocol, Src Port: http (80), Dst Port: 49656 (49656), Seq: 13795, Ack: 1, Len: 1460
Hypertext Transfer Protocol

No.     Time           Source                Destination           Protocol Length Info
     20 0.785821000    31.12.68.207          192.168.1.4           HTTP     1101   Continuation or non-HTTP traffic

Frame 20: 1101 bytes on wire (8808 bits), 1101 bytes captured (8808 bits) on interface 0
Ethernet II, Src: Netgear_3b:4d:d2 (4c:60:de:3b:4d:d2), Dst: IntelCor_50:de:04 (00:23:15:50:de:04)
Internet Protocol Version 4, Src: 31.12.68.207 (31.12.68.207), Dst: 192.168.1.4 (192.168.1.4)
Transmission Control Protocol, Src Port: http (80), Dst Port: 49656 (49656), Seq: 15255, Ack: 1, Len: 1047
Hypertext Transfer Protocol

No.     Time           Source                Destination           Protocol Length Info
     21 0.785866000    192.168.1.4           31.12.68.207          TCP      54     49656 > http [ACK] Seq=1 Ack=16302 Win=1072 Len=0

Frame 21: 54 bytes on wire (432 bits), 54 bytes captured (432 bits) on interface 0
Ethernet II, Src: IntelCor_50:de:04 (00:23:15:50:de:04), Dst: Netgear_3b:4d:d2 (4c:60:de:3b:4d:d2)
Internet Protocol Version 4, Src: 192.168.1.4 (192.168.1.4), Dst: 31.12.68.207 (31.12.68.207)
Transmission Control Protocol, Src Port: 49656 (49656), Dst Port: http (80), Seq: 1, Ack: 16302, Len: 0

No.     Time           Source                Destination           Protocol Length Info
     22 0.856289000    31.12.68.207          192.168.1.4           HTTP     1514   Continuation or non-HTTP traffic

Frame 22: 1514 bytes on wire (12112 bits), 1514 bytes captured (12112 bits) on interface 0
Ethernet II, Src: Netgear_3b:4d:d2 (4c:60:de:3b:4d:d2), Dst: IntelCor_50:de:04 (00:23:15:50:de:04)
Internet Protocol Version 4, Src: 31.12.68.207 (31.12.68.207), Dst: 192.168.1.4 (192.168.1.4)
Transmission Control Protocol, Src Port: http (80), Dst Port: 49656 (49656), Seq: 16302, Ack: 1, Len: 1460
Hypertext Transfer Protocol

No.     Time           Source                Destination           Protocol Length Info
     23 0.886145000    31.12.68.207          192.168.1.4           HTTP     1102   Continuation or non-HTTP traffic

Frame 23: 1102 bytes on wire (8816 bits), 1102 bytes captured (8816 bits) on interface 0
Ethernet II, Src: Netgear_3b:4d:d2 (4c:60:de:3b:4d:d2), Dst: IntelCor_50:de:04 (00:23:15:50:de:04)
Internet Protocol Version 4, Src: 31.12.68.207 (31.12.68.207), Dst: 192.168.1.4 (192.168.1.4)
Transmission Control Protocol, Src Port: http (80), Dst Port: 49656 (49656), Seq: 17762, Ack: 1, Len: 1048
Hypertext Transfer Protocol

No.     Time           Source                Destination           Protocol Length Info
     24 0.886192000    192.168.1.4           31.12.68.207          TCP      54     49656 > http [ACK] Seq=1 Ack=18810 Win=1062 Len=0

Frame 24: 54 bytes on wire (432 bits), 54 bytes captured (432 bits) on interface 0
Ethernet II, Src: IntelCor_50:de:04 (00:23:15:50:de:04), Dst: Netgear_3b:4d:d2 (4c:60:de:3b:4d:d2)
Internet Protocol Version 4, Src: 192.168.1.4 (192.168.1.4), Dst: 31.12.68.207 (31.12.68.207)
Transmission Control Protocol, Src Port: 49656 (49656), Dst Port: http (80), Seq: 1, Ack: 18810, Len: 0

No.     Time           Source                Destination           Protocol Length Info
     25 1.271051000    31.12.68.207          192.168.1.4           HTTP     1308   Continuation or non-HTTP traffic

Frame 25: 1308 bytes on wire (10464 bits), 1308 bytes captured (10464 bits) on interface 0
Ethernet II, Src: Netgear_3b:4d:d2 (4c:60:de:3b:4d:d2), Dst: IntelCor_50:de:04 (00:23:15:50:de:04)
Internet Protocol Version 4, Src: 31.12.68.207 (31.12.68.207), Dst: 192.168.1.4 (192.168.1.4)
Transmission Control Protocol, Src Port: http (80), Dst Port: 49656 (49656), Seq: 18810, Ack: 1, Len: 1254
Hypertext Transfer Protocol

No.     Time           Source                Destination           Protocol Length Info
     26 1.394176000    31.12.68.207          192.168.1.4           HTTP     1514   [TCP Previous segment not captured] Continuation or non-HTTP traffic

Frame 26: 1514 bytes on wire (12112 bits), 1514 bytes captured (12112 bits) on interface 0
Ethernet II, Src: Netgear_3b:4d:d2 (4c:60:de:3b:4d:d2), Dst: IntelCor_50:de:04 (00:23:15:50:de:04)
Internet Protocol Version 4, Src: 31.12.68.207 (31.12.68.207), Dst: 192.168.1.4 (192.168.1.4)
Transmission Control Protocol, Src Port: http (80), Dst Port: 49656 (49656), Seq: 21524, Ack: 1, Len: 1460
Hypertext Transfer Protocol

No.     Time           Source                Destination           Protocol Length Info
     27 1.394227000    192.168.1.4           31.12.68.207          TCP      66     49656 > http [ACK] Seq=1 Ack=20064 Win=1057 Len=0 SLE=21524 SRE=22984

Frame 27: 66 bytes on wire (528 bits), 66 bytes captured (528 bits) on interface 0
Ethernet II, Src: IntelCor_50:de:04 (00:23:15:50:de:04), Dst: Netgear_3b:4d:d2 (4c:60:de:3b:4d:d2)
Internet Protocol Version 4, Src: 192.168.1.4 (192.168.1.4), Dst: 31.12.68.207 (31.12.68.207)
Transmission Control Protocol, Src Port: 49656 (49656), Dst Port: http (80), Seq: 1, Ack: 20064, Len: 0

No.     Time           Source                Destination           Protocol Length Info
     28 1.394625000    31.12.68.207          192.168.1.4           HTTP     1514   [TCP Out-Of-Order] Continuation or non-HTTP traffic

Frame 28: 1514 bytes on wire (12112 bits), 1514 bytes captured (12112 bits) on interface 0
Ethernet II, Src: Netgear_3b:4d:d2 (4c:60:de:3b:4d:d2), Dst: IntelCor_50:de:04 (00:23:15:50:de:04)
Internet Protocol Version 4, Src: 31.12.68.207 (31.12.68.207), Dst: 192.168.1.4 (192.168.1.4)
Transmission Control Protocol, Src Port: http (80), Dst Port: 49656 (49656), Seq: 20064, Ack: 1, Len: 1460
Hypertext Transfer Protocol

No.     Time           Source                Destination           Protocol Length Info
     29 1.394666000    192.168.1.4           31.12.68.207          TCP      54     49656 > http [ACK] Seq=1 Ack=22984 Win=1045 Len=0

Frame 29: 54 bytes on wire (432 bits), 54 bytes captured (432 bits) on interface 0
Ethernet II, Src: IntelCor_50:de:04 (00:23:15:50:de:04), Dst: Netgear_3b:4d:d2 (4c:60:de:3b:4d:d2)
Internet Protocol Version 4, Src: 192.168.1.4 (192.168.1.4), Dst: 31.12.68.207 (31.12.68.207)
Transmission Control Protocol, Src Port: 49656 (49656), Dst Port: http (80), Seq: 1, Ack: 22984, Len: 0

No.     Time           Source                Destination           Protocol Length Info
     30 1.451015000    173.194.43.54         192.168.1.4           TLSv1    109    Application Data

Frame 30: 109 bytes on wire (872 bits), 109 bytes captured (872 bits) on interface 0
Ethernet II, Src: Netgear_3b:4d:d2 (4c:60:de:3b:4d:d2), Dst: IntelCor_50:de:04 (00:23:15:50:de:04)
Internet Protocol Version 4, Src: 173.194.43.54 (173.194.43.54), Dst: 192.168.1.4 (192.168.1.4)
Transmission Control Protocol, Src Port: https (443), Dst Port: 49170 (49170), Seq: 1, Ack: 1, Len: 55
Secure Sockets Layer

No.     Time           Source                Destination           Protocol Length Info
     31 1.491610000    31.12.68.207          192.168.1.4           HTTP     897    Continuation or non-HTTP traffic

Frame 31: 897 bytes on wire (7176 bits), 897 bytes captured (7176 bits) on interface 0
Ethernet II, Src: Netgear_3b:4d:d2 (4c:60:de:3b:4d:d2), Dst: IntelCor_50:de:04 (00:23:15:50:de:04)
Internet Protocol Version 4, Src: 31.12.68.207 (31.12.68.207), Dst: 192.168.1.4 (192.168.1.4)
Transmission Control Protocol, Src Port: http (80), Dst Port: 49656 (49656), Seq: 22984, Ack: 1, Len: 843
Hypertext Transfer Protocol

No.     Time           Source                Destination           Protocol Length Info
     32 1.494712000    31.12.68.207          192.168.1.4           HTTP     1514   Continuation or non-HTTP traffic

Frame 32: 1514 bytes on wire (12112 bits), 1514 bytes captured (12112 bits) on interface 0
Ethernet II, Src: Netgear_3b:4d:d2 (4c:60:de:3b:4d:d2), Dst: IntelCor_50:de:04 (00:23:15:50:de:04)
Internet Protocol Version 4, Src: 31.12.68.207 (31.12.68.207), Dst: 192.168.1.4 (192.168.1.4)
Transmission Control Protocol, Src Port: http (80), Dst Port: 49656 (49656), Seq: 23827, Ack: 1, Len: 1460
Hypertext Transfer Protocol

No.     Time           Source                Destination           Protocol Length Info
     33 1.494797000    192.168.1.4           31.12.68.207          TCP      54     49656 > http [ACK] Seq=1 Ack=25287 Win=1036 Len=0

Frame 33: 54 bytes on wire (432 bits), 54 bytes captured (432 bits) on interface 0
Ethernet II, Src: IntelCor_50:de:04 (00:23:15:50:de:04), Dst: Netgear_3b:4d:d2 (4c:60:de:3b:4d:d2)
Internet Protocol Version 4, Src: 192.168.1.4 (192.168.1.4), Dst: 31.12.68.207 (31.12.68.207)
Transmission Control Protocol, Src Port: 49656 (49656), Dst Port: http (80), Seq: 1, Ack: 25287, Len: 0

No.     Time           Source                Destination           Protocol Length Info
     34 1.597367000    31.12.68.207          192.168.1.4           HTTP     1101   Continuation or non-HTTP traffic

Frame 34: 1101 bytes on wire (8808 bits), 1101 bytes captured (8808 bits) on interface 0
Ethernet II, Src: Netgear_3b:4d:d2 (4c:60:de:3b:4d:d2), Dst: IntelCor_50:de:04 (00:23:15:50:de:04)
Internet Protocol Version 4, Src: 31.12.68.207 (31.12.68.207), Dst: 192.168.1.4 (192.168.1.4)
Transmission Control Protocol, Src Port: http (80), Dst Port: 49656 (49656), Seq: 25287, Ack: 1, Len: 1047
Hypertext Transfer Protocol

No.     Time           Source                Destination           Protocol Length Info
     35 1.650335000    192.168.1.4           173.194.43.54         TCP      54     49170 > https [ACK] Seq=1 Ack=56 Win=26018 Len=0

Frame 35: 54 bytes on wire (432 bits), 54 bytes captured (432 bits) on interface 0
Ethernet II, Src: IntelCor_50:de:04 (00:23:15:50:de:04), Dst: Netgear_3b:4d:d2 (4c:60:de:3b:4d:d2)
Internet Protocol Version 4, Src: 192.168.1.4 (192.168.1.4), Dst: 173.194.43.54 (173.194.43.54)
Transmission Control Protocol, Src Port: 49170 (49170), Dst Port: https (443), Seq: 1, Ack: 56, Len: 0

No.     Time           Source                Destination           Protocol Length Info
     36 1.707408000    31.12.68.207          192.168.1.4           HTTP     1514   Continuation or non-HTTP traffic

Frame 36: 1514 bytes on wire (12112 bits), 1514 bytes captured (12112 bits) on interface 0
Ethernet II, Src: Netgear_3b:4d:d2 (4c:60:de:3b:4d:d2), Dst: IntelCor_50:de:04 (00:23:15:50:de:04)
Internet Protocol Version 4, Src: 31.12.68.207 (31.12.68.207), Dst: 192.168.1.4 (192.168.1.4)
Transmission Control Protocol, Src Port: http (80), Dst Port: 49656 (49656), Seq: 26334, Ack: 1, Len: 1460
Hypertext Transfer Protocol

No.     Time           Source                Destination           Protocol Length Info
     37 1.707476000    192.168.1.4           31.12.68.207          TCP      54     49656 > http [ACK] Seq=1 Ack=27794 Win=1027 Len=0

Frame 37: 54 bytes on wire (432 bits), 54 bytes captured (432 bits) on interface 0
Ethernet II, Src: IntelCor_50:de:04 (00:23:15:50:de:04), Dst: Netgear_3b:4d:d2 (4c:60:de:3b:4d:d2)
Internet Protocol Version 4, Src: 192.168.1.4 (192.168.1.4), Dst: 31.12.68.207 (31.12.68.207)
Transmission Control Protocol, Src Port: 49656 (49656), Dst Port: http (80), Seq: 1, Ack: 27794, Len: 0

No.     Time           Source                Destination           Protocol Length Info
     38 1.707841000    31.12.68.207          192.168.1.4           HTTP     1514   Continuation or non-HTTP traffic

Frame 38: 1514 bytes on wire (12112 bits), 1514 bytes captured (12112 bits) on interface 0
Ethernet II, Src: Netgear_3b:4d:d2 (4c:60:de:3b:4d:d2), Dst: IntelCor_50:de:04 (00:23:15:50:de:04)
Internet Protocol Version 4, Src: 31.12.68.207 (31.12.68.207), Dst: 192.168.1.4 (192.168.1.4)
Transmission Control Protocol, Src Port: http (80), Dst Port: 49656 (49656), Seq: 27794, Ack: 1, Len: 1460
Hypertext Transfer Protocol

No.     Time           Source                Destination           Protocol Length Info
     39 1.708545000    31.12.68.207          192.168.1.4           HTTP     1514   Continuation or non-HTTP traffic

Frame 39: 1514 bytes on wire (12112 bits), 1514 bytes captured (12112 bits) on interface 0
Ethernet II, Src: Netgear_3b:4d:d2 (4c:60:de:3b:4d:d2), Dst: IntelCor_50:de:04 (00:23:15:50:de:04)
Internet Protocol Version 4, Src: 31.12.68.207 (31.12.68.207), Dst: 192.168.1.4 (192.168.1.4)
Transmission Control Protocol, Src Port: http (80), Dst Port: 49656 (49656), Seq: 29254, Ack: 1, Len: 1460
Hypertext Transfer Protocol

No.     Time           Source                Destination           Protocol Length Info
     40 1.708576000    192.168.1.4           31.12.68.207          TCP      54     49656 > http [ACK] Seq=1 Ack=30714 Win=1015 Len=0

Frame 40: 54 bytes on wire (432 bits), 54 bytes captured (432 bits) on interface 0
Ethernet II, Src: IntelCor_50:de:04 (00:23:15:50:de:04), Dst: Netgear_3b:4d:d2 (4c:60:de:3b:4d:d2)
Internet Protocol Version 4, Src: 192.168.1.4 (192.168.1.4), Dst: 31.12.68.207 (31.12.68.207)
Transmission Control Protocol, Src Port: 49656 (49656), Dst Port: http (80), Seq: 1, Ack: 30714, Len: 0

No.     Time           Source                Destination           Protocol Length Info
     41 1.807650000    31.12.68.207          192.168.1.4           HTTP     690    Continuation or non-HTTP traffic

Frame 41: 690 bytes on wire (5520 bits), 690 bytes captured (5520 bits) on interface 0
Ethernet II, Src: Netgear_3b:4d:d2 (4c:60:de:3b:4d:d2), Dst: IntelCor_50:de:04 (00:23:15:50:de:04)
Internet Protocol Version 4, Src: 31.12.68.207 (31.12.68.207), Dst: 192.168.1.4 (192.168.1.4)
Transmission Control Protocol, Src Port: http (80), Dst Port: 49656 (49656), Seq: 30714, Ack: 1, Len: 636
Hypertext Transfer Protocol

No.     Time           Source                Destination           Protocol Length Info
     42 1.970760000    31.12.68.207          192.168.1.4           HTTP     1514   Continuation or non-HTTP traffic

Frame 42: 1514 bytes on wire (12112 bits), 1514 bytes captured (12112 bits) on interface 0
Ethernet II, Src: Netgear_3b:4d:d2 (4c:60:de:3b:4d:d2), Dst: IntelCor_50:de:04 (00:23:15:50:de:04)
Internet Protocol Version 4, Src: 31.12.68.207 (31.12.68.207), Dst: 192.168.1.4 (192.168.1.4)
Transmission Control Protocol, Src Port: http (80), Dst Port: 49656 (49656), Seq: 31350, Ack: 1, Len: 1460
Hypertext Transfer Protocol

No.     Time           Source                Destination           Protocol Length Info
     43 1.970811000    192.168.1.4           31.12.68.207          TCP      54     49656 > http [ACK] Seq=1 Ack=32810 Win=1007 Len=0

Frame 43: 54 bytes on wire (432 bits), 54 bytes captured (432 bits) on interface 0
Ethernet II, Src: IntelCor_50:de:04 (00:23:15:50:de:04), Dst: Netgear_3b:4d:d2 (4c:60:de:3b:4d:d2)
Internet Protocol Version 4, Src: 192.168.1.4 (192.168.1.4), Dst: 31.12.68.207 (31.12.68.207)
Transmission Control Protocol, Src Port: 49656 (49656), Dst Port: http (80), Seq: 1, Ack: 32810, Len: 0

No.     Time           Source                Destination           Protocol Length Info
     44 2.069538000    31.12.68.207          192.168.1.4           HTTP     1102   Continuation or non-HTTP traffic

Frame 44: 1102 bytes on wire (8816 bits), 1102 bytes captured (8816 bits) on interface 0
Ethernet II, Src: Netgear_3b:4d:d2 (4c:60:de:3b:4d:d2), Dst: IntelCor_50:de:04 (00:23:15:50:de:04)
Internet Protocol Version 4, Src: 31.12.68.207 (31.12.68.207), Dst: 192.168.1.4 (192.168.1.4)
Transmission Control Protocol, Src Port: http (80), Dst Port: 49656 (49656), Seq: 32810, Ack: 1, Len: 1048
Hypertext Transfer Protocol

No.     Time           Source                Destination           Protocol Length Info
     45 2.097936000    31.12.68.207          192.168.1.4           HTTP     1514   Continuation or non-HTTP traffic

Frame 45: 1514 bytes on wire (12112 bits), 1514 bytes captured (12112 bits) on interface 0
Ethernet II, Src: Netgear_3b:4d:d2 (4c:60:de:3b:4d:d2), Dst: IntelCor_50:de:04 (00:23:15:50:de:04)
Internet Protocol Version 4, Src: 31.12.68.207 (31.12.68.207), Dst: 192.168.1.4 (192.168.1.4)
Transmission Control Protocol, Src Port: http (80), Dst Port: 49656 (49656), Seq: 33858, Ack: 1, Len: 1460
Hypertext Transfer Protocol

No.     Time           Source                Destination           Protocol Length Info
     46 2.097975000    192.168.1.4           31.12.68.207          TCP      54     49656 > http [ACK] Seq=1 Ack=35318 Win=997 Len=0

Frame 46: 54 bytes on wire (432 bits), 54 bytes captured (432 bits) on interface 0
Ethernet II, Src: IntelCor_50:de:04 (00:23:15:50:de:04), Dst: Netgear_3b:4d:d2 (4c:60:de:3b:4d:d2)
Internet Protocol Version 4, Src: 192.168.1.4 (192.168.1.4), Dst: 31.12.68.207 (31.12.68.207)
Transmission Control Protocol, Src Port: 49656 (49656), Dst Port: http (80), Seq: 1, Ack: 35318, Len: 0

No.     Time           Source                Destination           Protocol Length Info
     47 2.195626000    31.12.68.207          192.168.1.4           HTTP     1101   Continuation or non-HTTP traffic

Frame 47: 1101 bytes on wire (8808 bits), 1101 bytes captured (8808 bits) on interface 0
Ethernet II, Src: Netgear_3b:4d:d2 (4c:60:de:3b:4d:d2), Dst: IntelCor_50:de:04 (00:23:15:50:de:04)
Internet Protocol Version 4, Src: 31.12.68.207 (31.12.68.207), Dst: 192.168.1.4 (192.168.1.4)
Transmission Control Protocol, Src Port: http (80), Dst Port: 49656 (49656), Seq: 35318, Ack: 1, Len: 1047
Hypertext Transfer Protocol

No.     Time           Source                Destination           Protocol Length Info
     48 2.340544000    31.12.68.207          192.168.1.4           HTTP     1514   Continuation or non-HTTP traffic

Frame 48: 1514 bytes on wire (12112 bits), 1514 bytes captured (12112 bits) on interface 0
Ethernet II, Src: Netgear_3b:4d:d2 (4c:60:de:3b:4d:d2), Dst: IntelCor_50:de:04 (00:23:15:50:de:04)
Internet Protocol Version 4, Src: 31.12.68.207 (31.12.68.207), Dst: 192.168.1.4 (192.168.1.4)
Transmission Control Protocol, Src Port: http (80), Dst Port: 49656 (49656), Seq: 36365, Ack: 1, Len: 1460
Hypertext Transfer Protocol

No.     Time           Source                Destination           Protocol Length Info
     49 2.340595000    192.168.1.4           31.12.68.207          TCP      54     49656 > http [ACK] Seq=1 Ack=37825 Win=987 Len=0

Frame 49: 54 bytes on wire (432 bits), 54 bytes captured (432 bits) on interface 0
Ethernet II, Src: IntelCor_50:de:04 (00:23:15:50:de:04), Dst: Netgear_3b:4d:d2 (4c:60:de:3b:4d:d2)
Internet Protocol Version 4, Src: 192.168.1.4 (192.168.1.4), Dst: 31.12.68.207 (31.12.68.207)
Transmission Control Protocol, Src Port: 49656 (49656), Dst Port: http (80), Seq: 1, Ack: 37825, Len: 0

No.     Time           Source                Destination           Protocol Length Info
     50 2.439969000    31.12.68.207          192.168.1.4           HTTP     1103   Continuation or non-HTTP traffic

Frame 50: 1103 bytes on wire (8824 bits), 1103 bytes captured (8824 bits) on interface 0
Ethernet II, Src: Netgear_3b:4d:d2 (4c:60:de:3b:4d:d2), Dst: IntelCor_50:de:04 (00:23:15:50:de:04)
Internet Protocol Version 4, Src: 31.12.68.207 (31.12.68.207), Dst: 192.168.1.4 (192.168.1.4)
Transmission Control Protocol, Src Port: http (80), Dst Port: 49656 (49656), Seq: 37825, Ack: 1, Len: 1049
Hypertext Transfer Protocol

No.     Time           Source                Destination           Protocol Length Info
     51 2.452782000    31.12.68.207          192.168.1.4           HTTP     1514   Continuation or non-HTTP traffic

Frame 51: 1514 bytes on wire (12112 bits), 1514 bytes captured (12112 bits) on interface 0
Ethernet II, Src: Netgear_3b:4d:d2 (4c:60:de:3b:4d:d2), Dst: IntelCor_50:de:04 (00:23:15:50:de:04)
Internet Protocol Version 4, Src: 31.12.68.207 (31.12.68.207), Dst: 192.168.1.4 (192.168.1.4)
Transmission Control Protocol, Src Port: http (80), Dst Port: 49656 (49656), Seq: 38874, Ack: 1, Len: 1460
Hypertext Transfer Protocol

No.     Time           Source                Destination           Protocol Length Info
     52 2.452817000    192.168.1.4           31.12.68.207          TCP      54     49656 > http [ACK] Seq=1 Ack=40334 Win=978 Len=0

Frame 52: 54 bytes on wire (432 bits), 54 bytes captured (432 bits) on interface 0
Ethernet II, Src: IntelCor_50:de:04 (00:23:15:50:de:04), Dst: Netgear_3b:4d:d2 (4c:60:de:3b:4d:d2)
Internet Protocol Version 4, Src: 192.168.1.4 (192.168.1.4), Dst: 31.12.68.207 (31.12.68.207)
Transmission Control Protocol, Src Port: 49656 (49656), Dst Port: http (80), Seq: 1, Ack: 40334, Len: 0

No.     Time           Source                Destination           Protocol Length Info
     53 2.546252000    31.12.68.207          192.168.1.4           HTTP     1514   Continuation or non-HTTP traffic

Frame 53: 1514 bytes on wire (12112 bits), 1514 bytes captured (12112 bits) on interface 0
Ethernet II, Src: Netgear_3b:4d:d2 (4c:60:de:3b:4d:d2), Dst: IntelCor_50:de:04 (00:23:15:50:de:04)
Internet Protocol Version 4, Src: 31.12.68.207 (31.12.68.207), Dst: 192.168.1.4 (192.168.1.4)
Transmission Control Protocol, Src Port: http (80), Dst Port: 49656 (49656), Seq: 40334, Ack: 1, Len: 1460
Hypertext Transfer Protocol

No.     Time           Source                Destination           Protocol Length Info
     54 2.546696000    31.12.68.207          192.168.1.4           HTTP     1514   Continuation or non-HTTP traffic

Frame 54: 1514 bytes on wire (12112 bits), 1514 bytes captured (12112 bits) on interface 0
Ethernet II, Src: Netgear_3b:4d:d2 (4c:60:de:3b:4d:d2), Dst: IntelCor_50:de:04 (00:23:15:50:de:04)
Internet Protocol Version 4, Src: 31.12.68.207 (31.12.68.207), Dst: 192.168.1.4 (192.168.1.4)
Transmission Control Protocol, Src Port: http (80), Dst Port: 49656 (49656), Seq: 41794, Ack: 1, Len: 1460
Hypertext Transfer Protocol

No.     Time           Source                Destination           Protocol Length Info
     55 2.546730000    192.168.1.4           31.12.68.207          TCP      54     49656 > http [ACK] Seq=1 Ack=43254 Win=966 Len=0

Frame 55: 54 bytes on wire (432 bits), 54 bytes captured (432 bits) on interface 0
Ethernet II, Src: IntelCor_50:de:04 (00:23:15:50:de:04), Dst: Netgear_3b:4d:d2 (4c:60:de:3b:4d:d2)
Internet Protocol Version 4, Src: 192.168.1.4 (192.168.1.4), Dst: 31.12.68.207 (31.12.68.207)
Transmission Control Protocol, Src Port: 49656 (49656), Dst Port: http (80), Seq: 1, Ack: 43254, Len: 0

No.     Time           Source                Destination           Protocol Length Info
     56 2.551569000    31.12.68.207          192.168.1.4           HTTP     690    Continuation or non-HTTP traffic

Frame 56: 690 bytes on wire (5520 bits), 690 bytes captured (5520 bits) on interface 0
Ethernet II, Src: Netgear_3b:4d:d2 (4c:60:de:3b:4d:d2), Dst: IntelCor_50:de:04 (00:23:15:50:de:04)
Internet Protocol Version 4, Src: 31.12.68.207 (31.12.68.207), Dst: 192.168.1.4 (192.168.1.4)
Transmission Control Protocol, Src Port: http (80), Dst Port: 49656 (49656), Seq: 43254, Ack: 1, Len: 636
Hypertext Transfer Protocol

No.     Time           Source                Destination           Protocol Length Info
     57 2.696295000    31.12.68.207          192.168.1.4           HTTP     1514   Continuation or non-HTTP traffic

Frame 57: 1514 bytes on wire (12112 bits), 1514 bytes captured (12112 bits) on interface 0
Ethernet II, Src: Netgear_3b:4d:d2 (4c:60:de:3b:4d:d2), Dst: IntelCor_50:de:04 (00:23:15:50:de:04)
Internet Protocol Version 4, Src: 31.12.68.207 (31.12.68.207), Dst: 192.168.1.4 (192.168.1.4)
Transmission Control Protocol, Src Port: http (80), Dst Port: 49656 (49656), Seq: 43890, Ack: 1, Len: 1460
Hypertext Transfer Protocol

No.     Time           Source                Destination           Protocol Length Info
     58 2.696347000    192.168.1.4           31.12.68.207          TCP      54     49656 > http [ACK] Seq=1 Ack=45350 Win=958 Len=0

Frame 58: 54 bytes on wire (432 bits), 54 bytes captured (432 bits) on interface 0
Ethernet II, Src: IntelCor_50:de:04 (00:23:15:50:de:04), Dst: Netgear_3b:4d:d2 (4c:60:de:3b:4d:d2)
Internet Protocol Version 4, Src: 192.168.1.4 (192.168.1.4), Dst: 31.12.68.207 (31.12.68.207)
Transmission Control Protocol, Src Port: 49656 (49656), Dst Port: http (80), Seq: 1, Ack: 45350, Len: 0

No.     Time           Source                Destination           Protocol Length Info
     59 2.793657000    31.12.68.207          192.168.1.4           HTTP     1101   Continuation or non-HTTP traffic

Frame 59: 1101 bytes on wire (8808 bits), 1101 bytes captured (8808 bits) on interface 0
Ethernet II, Src: Netgear_3b:4d:d2 (4c:60:de:3b:4d:d2), Dst: IntelCor_50:de:04 (00:23:15:50:de:04)
Internet Protocol Version 4, Src: 31.12.68.207 (31.12.68.207), Dst: 192.168.1.4 (192.168.1.4)
Transmission Control Protocol, Src Port: http (80), Dst Port: 49656 (49656), Seq: 45350, Ack: 1, Len: 1047
Hypertext Transfer Protocol

No.     Time           Source                Destination           Protocol Length Info
     60 2.831650000    31.12.68.207          192.168.1.4           HTTP     1514   Continuation or non-HTTP traffic

Frame 60: 1514 bytes on wire (12112 bits), 1514 bytes captured (12112 bits) on interface 0
Ethernet II, Src: Netgear_3b:4d:d2 (4c:60:de:3b:4d:d2), Dst: IntelCor_50:de:04 (00:23:15:50:de:04)
Internet Protocol Version 4, Src: 31.12.68.207 (31.12.68.207), Dst: 192.168.1.4 (192.168.1.4)
Transmission Control Protocol, Src Port: http (80), Dst Port: 49656 (49656), Seq: 46397, Ack: 1, Len: 1460
Hypertext Transfer Protocol

No.     Time           Source                Destination           Protocol Length Info
     61 2.831700000    192.168.1.4           31.12.68.207          TCP      54     49656 > http [ACK] Seq=1 Ack=47857 Win=948 Len=0

Frame 61: 54 bytes on wire (432 bits), 54 bytes captured (432 bits) on interface 0
Ethernet II, Src: IntelCor_50:de:04 (00:23:15:50:de:04), Dst: Netgear_3b:4d:d2 (4c:60:de:3b:4d:d2)
Internet Protocol Version 4, Src: 192.168.1.4 (192.168.1.4), Dst: 31.12.68.207 (31.12.68.207)
Transmission Control Protocol, Src Port: 49656 (49656), Dst Port: http (80), Seq: 1, Ack: 47857, Len: 0

No.     Time           Source                Destination           Protocol Length Info
     62 2.929770000    31.12.68.207          192.168.1.4           HTTP     1102   Continuation or non-HTTP traffic

Frame 62: 1102 bytes on wire (8816 bits), 1102 bytes captured (8816 bits) on interface 0
Ethernet II, Src: Netgear_3b:4d:d2 (4c:60:de:3b:4d:d2), Dst: IntelCor_50:de:04 (00:23:15:50:de:04)
Internet Protocol Version 4, Src: 31.12.68.207 (31.12.68.207), Dst: 192.168.1.4 (192.168.1.4)
Transmission Control Protocol, Src Port: http (80), Dst Port: 49656 (49656), Seq: 47857, Ack: 1, Len: 1048
Hypertext Transfer Protocol

No.     Time           Source                Destination           Protocol Length Info
     63 3.050714000    31.12.68.207          192.168.1.4           HTTP     1514   Continuation or non-HTTP traffic

Frame 63: 1514 bytes on wire (12112 bits), 1514 bytes captured (12112 bits) on interface 0
Ethernet II, Src: Netgear_3b:4d:d2 (4c:60:de:3b:4d:d2), Dst: IntelCor_50:de:04 (00:23:15:50:de:04)
Internet Protocol Version 4, Src: 31.12.68.207 (31.12.68.207), Dst: 192.168.1.4 (192.168.1.4)
Transmission Control Protocol, Src Port: http (80), Dst Port: 49656 (49656), Seq: 48905, Ack: 1, Len: 1460
Hypertext Transfer Protocol

No.     Time           Source                Destination           Protocol Length Info
     64 3.050761000    192.168.1.4           31.12.68.207          TCP      54     49656 > http [ACK] Seq=1 Ack=50365 Win=938 Len=0

Frame 64: 54 bytes on wire (432 bits), 54 bytes captured (432 bits) on interface 0
Ethernet II, Src: IntelCor_50:de:04 (00:23:15:50:de:04), Dst: Netgear_3b:4d:d2 (4c:60:de:3b:4d:d2)
Internet Protocol Version 4, Src: 192.168.1.4 (192.168.1.4), Dst: 31.12.68.207 (31.12.68.207)
Transmission Control Protocol, Src Port: 49656 (49656), Dst Port: http (80), Seq: 1, Ack: 50365, Len: 0

No.     Time           Source                Destination           Protocol Length Info
     65 3.149577000    31.12.68.207          192.168.1.4           HTTP     1102   Continuation or non-HTTP traffic

Frame 65: 1102 bytes on wire (8816 bits), 1102 bytes captured (8816 bits) on interface 0
Ethernet II, Src: Netgear_3b:4d:d2 (4c:60:de:3b:4d:d2), Dst: IntelCor_50:de:04 (00:23:15:50:de:04)
Internet Protocol Version 4, Src: 31.12.68.207 (31.12.68.207), Dst: 192.168.1.4 (192.168.1.4)
Transmission Control Protocol, Src Port: http (80), Dst Port: 49656 (49656), Seq: 50365, Ack: 1, Len: 1048
Hypertext Transfer Protocol

No.     Time           Source                Destination           Protocol Length Info
     66 3.159376000    31.12.68.207          192.168.1.4           HTTP     1514   Continuation or non-HTTP traffic

Frame 66: 1514 bytes on wire (12112 bits), 1514 bytes captured (12112 bits) on interface 0
Ethernet II, Src: Netgear_3b:4d:d2 (4c:60:de:3b:4d:d2), Dst: IntelCor_50:de:04 (00:23:15:50:de:04)
Internet Protocol Version 4, Src: 31.12.68.207 (31.12.68.207), Dst: 192.168.1.4 (192.168.1.4)
Transmission Control Protocol, Src Port: http (80), Dst Port: 49656 (49656), Seq: 51413, Ack: 1, Len: 1460
Hypertext Transfer Protocol

No.     Time           Source                Destination           Protocol Length Info
     67 3.159423000    192.168.1.4           31.12.68.207          TCP      54     49656 > http [ACK] Seq=1 Ack=52873 Win=929 Len=0

Frame 67: 54 bytes on wire (432 bits), 54 bytes captured (432 bits) on interface 0
Ethernet II, Src: IntelCor_50:de:04 (00:23:15:50:de:04), Dst: Netgear_3b:4d:d2 (4c:60:de:3b:4d:d2)
Internet Protocol Version 4, Src: 192.168.1.4 (192.168.1.4), Dst: 31.12.68.207 (31.12.68.207)
Transmission Control Protocol, Src Port: 49656 (49656), Dst Port: http (80), Seq: 1, Ack: 52873, Len: 0

No.     Time           Source                Destination           Protocol Length Info
     68 3.265689000    31.12.68.207          192.168.1.4           HTTP     1102   Continuation or non-HTTP traffic

Frame 68: 1102 bytes on wire (8816 bits), 1102 bytes captured (8816 bits) on interface 0
Ethernet II, Src: Netgear_3b:4d:d2 (4c:60:de:3b:4d:d2), Dst: IntelCor_50:de:04 (00:23:15:50:de:04)
Internet Protocol Version 4, Src: 31.12.68.207 (31.12.68.207), Dst: 192.168.1.4 (192.168.1.4)
Transmission Control Protocol, Src Port: http (80), Dst Port: 49656 (49656), Seq: 52873, Ack: 1, Len: 1048
Hypertext Transfer Protocol

No.     Time           Source                Destination           Protocol Length Info
     69 3.451238000    31.12.68.207          192.168.1.4           HTTP     1514   Continuation or non-HTTP traffic

Frame 69: 1514 bytes on wire (12112 bits), 1514 bytes captured (12112 bits) on interface 0
Ethernet II, Src: Netgear_3b:4d:d2 (4c:60:de:3b:4d:d2), Dst: IntelCor_50:de:04 (00:23:15:50:de:04)
Internet Protocol Version 4, Src: 31.12.68.207 (31.12.68.207), Dst: 192.168.1.4 (192.168.1.4)
Transmission Control Protocol, Src Port: http (80), Dst Port: 49656 (49656), Seq: 53921, Ack: 1, Len: 1460
Hypertext Transfer Protocol

No.     Time           Source                Destination           Protocol Length Info
     70 3.451364000    192.168.1.4           31.12.68.207          TCP      54     49656 > http [ACK] Seq=1 Ack=55381 Win=919 Len=0

Frame 70: 54 bytes on wire (432 bits), 54 bytes captured (432 bits) on interface 0
Ethernet II, Src: IntelCor_50:de:04 (00:23:15:50:de:04), Dst: Netgear_3b:4d:d2 (4c:60:de:3b:4d:d2)
Internet Protocol Version 4, Src: 192.168.1.4 (192.168.1.4), Dst: 31.12.68.207 (31.12.68.207)
Transmission Control Protocol, Src Port: 49656 (49656), Dst Port: http (80), Seq: 1, Ack: 55381, Len: 0

No.     Time           Source                Destination           Protocol Length Info
     71 3.553423000    31.12.68.207          192.168.1.4           HTTP     1102   Continuation or non-HTTP traffic

Frame 71: 1102 bytes on wire (8816 bits), 1102 bytes captured (8816 bits) on interface 0
Ethernet II, Src: Netgear_3b:4d:d2 (4c:60:de:3b:4d:d2), Dst: IntelCor_50:de:04 (00:23:15:50:de:04)
Internet Protocol Version 4, Src: 31.12.68.207 (31.12.68.207), Dst: 192.168.1.4 (192.168.1.4)
Transmission Control Protocol, Src Port: http (80), Dst Port: 49656 (49656), Seq: 55381, Ack: 1, Len: 1048
Hypertext Transfer Protocol

No.     Time           Source                Destination           Protocol Length Info
     72 3.562600000    31.12.68.207          192.168.1.4           HTTP     1514   [TCP Previous segment not captured] Continuation or non-HTTP traffic

Frame 72: 1514 bytes on wire (12112 bits), 1514 bytes captured (12112 bits) on interface 0
Ethernet II, Src: Netgear_3b:4d:d2 (4c:60:de:3b:4d:d2), Dst: IntelCor_50:de:04 (00:23:15:50:de:04)
Internet Protocol Version 4, Src: 31.12.68.207 (31.12.68.207), Dst: 192.168.1.4 (192.168.1.4)
Transmission Control Protocol, Src Port: http (80), Dst Port: 49656 (49656), Seq: 57889, Ack: 1, Len: 1460
Hypertext Transfer Protocol

No.     Time           Source                Destination           Protocol Length Info
     73 3.562637000    192.168.1.4           31.12.68.207          TCP      66     49656 > http [ACK] Seq=1 Ack=56429 Win=915 Len=0 SLE=57889 SRE=59349

Frame 73: 66 bytes on wire (528 bits), 66 bytes captured (528 bits) on interface 0
Ethernet II, Src: IntelCor_50:de:04 (00:23:15:50:de:04), Dst: Netgear_3b:4d:d2 (4c:60:de:3b:4d:d2)
Internet Protocol Version 4, Src: 192.168.1.4 (192.168.1.4), Dst: 31.12.68.207 (31.12.68.207)
Transmission Control Protocol, Src Port: 49656 (49656), Dst Port: http (80), Seq: 1, Ack: 56429, Len: 0

No.     Time           Source                Destination           Protocol Length Info
     74 3.563000000    31.12.68.207          192.168.1.4           HTTP     1514   [TCP Out-Of-Order] Continuation or non-HTTP traffic

Frame 74: 1514 bytes on wire (12112 bits), 1514 bytes captured (12112 bits) on interface 0
Ethernet II, Src: Netgear_3b:4d:d2 (4c:60:de:3b:4d:d2), Dst: IntelCor_50:de:04 (00:23:15:50:de:04)
Internet Protocol Version 4, Src: 31.12.68.207 (31.12.68.207), Dst: 192.168.1.4 (192.168.1.4)
Transmission Control Protocol, Src Port: http (80), Dst Port: 49656 (49656), Seq: 56429, Ack: 1, Len: 1460
Hypertext Transfer Protocol

No.     Time           Source                Destination           Protocol Length Info
     75 3.563037000    192.168.1.4           31.12.68.207          TCP      54     49656 > http [ACK] Seq=1 Ack=59349 Win=903 Len=0

Frame 75: 54 bytes on wire (432 bits), 54 bytes captured (432 bits) on interface 0
Ethernet II, Src: IntelCor_50:de:04 (00:23:15:50:de:04), Dst: Netgear_3b:4d:d2 (4c:60:de:3b:4d:d2)
Internet Protocol Version 4, Src: 192.168.1.4 (192.168.1.4), Dst: 31.12.68.207 (31.12.68.207)
Transmission Control Protocol, Src Port: 49656 (49656), Dst Port: http (80), Seq: 1, Ack: 59349, Len: 0

No.     Time           Source                Destination           Protocol Length Info
     76 3.563988000    31.12.68.207          192.168.1.4           HTTP     1514   Continuation or non-HTTP traffic

Frame 76: 1514 bytes on wire (12112 bits), 1514 bytes captured (12112 bits) on interface 0
Ethernet II, Src: Netgear_3b:4d:d2 (4c:60:de:3b:4d:d2), Dst: IntelCor_50:de:04 (00:23:15:50:de:04)
Internet Protocol Version 4, Src: 31.12.68.207 (31.12.68.207), Dst: 192.168.1.4 (192.168.1.4)
Transmission Control Protocol, Src Port: http (80), Dst Port: 49656 (49656), Seq: 59349, Ack: 1, Len: 1460
Hypertext Transfer Protocol

No.     Time           Source                Destination           Protocol Length Info
     77 3.661244000    31.12.68.207          192.168.1.4           HTTP     690    Continuation or non-HTTP traffic

Frame 77: 690 bytes on wire (5520 bits), 690 bytes captured (5520 bits) on interface 0
Ethernet II, Src: Netgear_3b:4d:d2 (4c:60:de:3b:4d:d2), Dst: IntelCor_50:de:04 (00:23:15:50:de:04)
Internet Protocol Version 4, Src: 31.12.68.207 (31.12.68.207), Dst: 192.168.1.4 (192.168.1.4)
Transmission Control Protocol, Src Port: http (80), Dst Port: 49656 (49656), Seq: 60809, Ack: 1, Len: 636
Hypertext Transfer Protocol

No.     Time           Source                Destination           Protocol Length Info
     78 3.661301000    192.168.1.4           31.12.68.207          TCP      54     49656 > http [ACK] Seq=1 Ack=61445 Win=895 Len=0

Frame 78: 54 bytes on wire (432 bits), 54 bytes captured (432 bits) on interface 0
Ethernet II, Src: IntelCor_50:de:04 (00:23:15:50:de:04), Dst: Netgear_3b:4d:d2 (4c:60:de:3b:4d:d2)
Internet Protocol Version 4, Src: 192.168.1.4 (192.168.1.4), Dst: 31.12.68.207 (31.12.68.207)
Transmission Control Protocol, Src Port: 49656 (49656), Dst Port: http (80), Seq: 1, Ack: 61445, Len: 0

No.     Time           Source                Destination           Protocol Length Info
     79 3.775076000    31.12.68.207          192.168.1.4           HTTP     1308   Continuation or non-HTTP traffic

Frame 79: 1308 bytes on wire (10464 bits), 1308 bytes captured (10464 bits) on interface 0
Ethernet II, Src: Netgear_3b:4d:d2 (4c:60:de:3b:4d:d2), Dst: IntelCor_50:de:04 (00:23:15:50:de:04)
Internet Protocol Version 4, Src: 31.12.68.207 (31.12.68.207), Dst: 192.168.1.4 (192.168.1.4)
Transmission Control Protocol, Src Port: http (80), Dst Port: 49656 (49656), Seq: 61445, Ack: 1, Len: 1254
Hypertext Transfer Protocol

No.     Time           Source                Destination           Protocol Length Info
     80 3.958031000    31.12.68.207          192.168.1.4           HTTP     1514   Continuation or non-HTTP traffic

Frame 80: 1514 bytes on wire (12112 bits), 1514 bytes captured (12112 bits) on interface 0
Ethernet II, Src: Netgear_3b:4d:d2 (4c:60:de:3b:4d:d2), Dst: IntelCor_50:de:04 (00:23:15:50:de:04)
Internet Protocol Version 4, Src: 31.12.68.207 (31.12.68.207), Dst: 192.168.1.4 (192.168.1.4)
Transmission Control Protocol, Src Port: http (80), Dst Port: 49656 (49656), Seq: 62699, Ack: 1, Len: 1460
Hypertext Transfer Protocol
