No.     Time           Source                Destination           Protocol Length Info
      1 0.000000000    31.12.68.207          192.168.1.4           HTTP     1514   Continuation or non-HTTP traffic

Frame 1: 1514 bytes on wire (12112 bits), 1514 bytes captured (12112 bits) on interface 0
Ethernet II, Src: Netgear_3b:4d:d2 (4c:60:de:3b:4d:d2), Dst: IntelCor_50:de:04 (00:23:15:50:de:04)
Internet Protocol Version 4, Src: 31.12.68.207 (31.12.68.207), Dst: 192.168.1.4 (192.168.1.4)
Transmission Control Protocol, Src Port: http (80), Dst Port: 49656 (49656), Seq: 1, Ack: 1, Len: 1460
Hypertext Transfer Protocol

No.     Time           Source                Destination           Protocol Length Info
      2 0.000058000    192.168.1.4           31.12.68.207          TCP      54     49656 > http [ACK] Seq=1 Ack=1461 Win=1542 Len=0

Frame 2: 54 bytes on wire (432 bits), 54 bytes captured (432 bits) on interface 0
Ethernet II, Src: IntelCor_50:de:04 (00:23:15:50:de:04), Dst: Netgear_3b:4d:d2 (4c:60:de:3b:4d:d2)
Internet Protocol Version 4, Src: 192.168.1.4 (192.168.1.4), Dst: 31.12.68.207 (31.12.68.207)
Transmission Control Protocol, Src Port: 49656 (49656), Dst Port: http (80), Seq: 1, Ack: 1461, Len: 0

No.     Time           Source                Destination           Protocol Length Info
      3 0.000337000    31.12.68.207          192.168.1.4           HTTP     1514   Continuation or non-HTTP traffic

Frame 3: 1514 bytes on wire (12112 bits), 1514 bytes captured (12112 bits) on interface 0
Ethernet II, Src: Netgear_3b:4d:d2 (4c:60:de:3b:4d:d2), Dst: IntelCor_50:de:04 (00:23:15:50:de:04)
Internet Protocol Version 4, Src: 31.12.68.207 (31.12.68.207), Dst: 192.168.1.4 (192.168.1.4)
Transmission Control Protocol, Src Port: http (80), Dst Port: 49656 (49656), Seq: 1461, Ack: 1, Len: 1460
Hypertext Transfer Protocol

No.     Time           Source                Destination           Protocol Length Info
      4 0.003951000    31.12.68.207          192.168.1.4           HTTP     690    Continuation or non-HTTP traffic

Frame 4: 690 bytes on wire (5520 bits), 690 bytes captured (5520 bits) on interface 0
Ethernet II, Src: Netgear_3b:4d:d2 (4c:60:de:3b:4d:d2), Dst: IntelCor_50:de:04 (00:23:15:50:de:04)
Internet Protocol Version 4, Src: 31.12.68.207 (31.12.68.207), Dst: 192.168.1.4 (192.168.1.4)
Transmission Control Protocol, Src Port: http (80), Dst Port: 49656 (49656), Seq: 2921, Ack: 1, Len: 636
Hypertext Transfer Protocol

No.     Time           Source                Destination           Protocol Length Info
      5 0.003988000    192.168.1.4           31.12.68.207          TCP      54     49656 > http [ACK] Seq=1 Ack=3557 Win=1534 Len=0

Frame 5: 54 bytes on wire (432 bits), 54 bytes captured (432 bits) on interface 0
Ethernet II, Src: IntelCor_50:de:04 (00:23:15:50:de:04), Dst: Netgear_3b:4d:d2 (4c:60:de:3b:4d:d2)
Internet Protocol Version 4, Src: 192.168.1.4 (192.168.1.4), Dst: 31.12.68.207 (31.12.68.207)
Transmission Control Protocol, Src Port: 49656 (49656), Dst Port: http (80), Seq: 1, Ack: 3557, Len: 0

No.     Time           Source                Destination           Protocol Length Info
      6 0.273654000    31.12.68.207          192.168.1.4           HTTP     1308   Continuation or non-HTTP traffic

Frame 6: 1308 bytes on wire (10464 bits), 1308 bytes captured (10464 bits) on interface 0
Ethernet II, Src: Netgear_3b:4d:d2 (4c:60:de:3b:4d:d2), Dst: IntelCor_50:de:04 (00:23:15:50:de:04)
Internet Protocol Version 4, Src: 31.12.68.207 (31.12.68.207), Dst: 192.168.1.4 (192.168.1.4)
Transmission Control Protocol, Src Port: http (80), Dst Port: 49656 (49656), Seq: 3557, Ack: 1, Len: 1254
Hypertext Transfer Protocol

No.     Time           Source                Destination           Protocol Length Info
      7 0.369617000    31.12.68.207          192.168.1.4           HTTP     1514   Continuation or non-HTTP traffic

Frame 7: 1514 bytes on wire (12112 bits), 1514 bytes captured (12112 bits) on interface 0
Ethernet II, Src: Netgear_3b:4d:d2 (4c:60:de:3b:4d:d2), Dst: IntelCor_50:de:04 (00:23:15:50:de:04)
Internet Protocol Version 4, Src: 31.12.68.207 (31.12.68.207), Dst: 192.168.1.4 (192.168.1.4)
Transmission Control Protocol, Src Port: http (80), Dst Port: 49656 (49656), Seq: 4811, Ack: 1, Len: 1460
Hypertext Transfer Protocol

No.     Time           Source                Destination           Protocol Length Info
      8 0.369671000    192.168.1.4           31.12.68.207          TCP      54     49656 > http [ACK] Seq=1 Ack=6271 Win=1524 Len=0

Frame 8: 54 bytes on wire (432 bits), 54 bytes captured (432 bits) on interface 0
Ethernet II, Src: IntelCor_50:de:04 (00:23:15:50:de:04), Dst: Netgear_3b:4d:d2 (4c:60:de:3b:4d:d2)
Internet Protocol Version 4, Src: 192.168.1.4 (192.168.1.4), Dst: 31.12.68.207 (31.12.68.207)
Transmission Control Protocol, Src Port: 49656 (49656), Dst Port: http (80), Seq: 1, Ack: 6271, Len: 0

No.     Time           Source                Destination           Protocol Length Info
      9 0.370077000    31.12.68.207          192.168.1.4           HTTP     1514   Continuation or non-HTTP traffic

Frame 9: 1514 bytes on wire (12112 bits), 1514 bytes captured (12112 bits) on interface 0
Ethernet II, Src: Netgear_3b:4d:d2 (4c:60:de:3b:4d:d2), Dst: IntelCor_50:de:04 (00:23:15:50:de:04)
Internet Protocol Version 4, Src: 31.12.68.207 (31.12.68.207), Dst: 192.168.1.4 (192.168.1.4)
Transmission Control Protocol, Src Port: http (80), Dst Port: 49656 (49656), Seq: 6271, Ack: 1, Len: 1460
Hypertext Transfer Protocol

No.     Time           Source                Destination           Protocol Length Info
     10 0.467714000    31.12.68.207          192.168.1.4           HTTP     896    Continuation or non-HTTP traffic

Frame 10: 896 bytes on wire (7168 bits), 896 bytes captured (7168 bits) on interface 0
Ethernet II, Src: Netgear_3b:4d:d2 (4c:60:de:3b:4d:d2), Dst: IntelCor_50:de:04 (00:23:15:50:de:04)
Internet Protocol Version 4, Src: 31.12.68.207 (31.12.68.207), Dst: 192.168.1.4 (192.168.1.4)
Transmission Control Protocol, Src Port: http (80), Dst Port: 49656 (49656), Seq: 7731, Ack: 1, Len: 842
Hypertext Transfer Protocol

No.     Time           Source                Destination           Protocol Length Info
     11 0.467819000    192.168.1.4           31.12.68.207          TCP      54     49656 > http [ACK] Seq=1 Ack=8573 Win=1515 Len=0

Frame 11: 54 bytes on wire (432 bits), 54 bytes captured (432 bits) on interface 0
Ethernet II, Src: IntelCor_50:de:04 (00:23:15:50:de:04), Dst: Netgear_3b:4d:d2 (4c:60:de:3b:4d:d2)
Internet Protocol Version 4, Src: 192.168.1.4 (192.168.1.4), Dst: 31.12.68.207 (31.12.68.207)
Transmission Control Protocol, Src Port: 49656 (49656), Dst Port: http (80), Seq: 1, Ack: 8573, Len: 0

No.     Time           Source                Destination           Protocol Length Info
     12 0.484892000    31.12.68.207          192.168.1.4           HTTP     1514   Continuation or non-HTTP traffic

Frame 12: 1514 bytes on wire (12112 bits), 1514 bytes captured (12112 bits) on interface 0
Ethernet II, Src: Netgear_3b:4d:d2 (4c:60:de:3b:4d:d2), Dst: IntelCor_50:de:04 (00:23:15:50:de:04)
Internet Protocol Version 4, Src: 31.12.68.207 (31.12.68.207), Dst: 192.168.1.4 (192.168.1.4)
Transmission Control Protocol, Src Port: http (80), Dst Port: 49656 (49656), Seq: 8573, Ack: 1, Len: 1460
Hypertext Transfer Protocol

No.     Time           Source                Destination           Protocol Length Info
     13 0.565707000    31.12.68.207          192.168.1.4           HTTP     1101   Continuation or non-HTTP traffic

Frame 13: 1101 bytes on wire (8808 bits), 1101 bytes captured (8808 bits) on interface 0
Ethernet II, Src: Netgear_3b:4d:d2 (4c:60:de:3b:4d:d2), Dst: IntelCor_50:de:04 (00:23:15:50:de:04)
Internet Protocol Version 4, Src: 31.12.68.207 (31.12.68.207), Dst: 192.168.1.4 (192.168.1.4)
Transmission Control Protocol, Src Port: http (80), Dst Port: 49656 (49656), Seq: 10033, Ack: 1, Len: 1047
Hypertext Transfer Protocol

No.     Time           Source                Destination           Protocol Length Info
     14 0.565756000    192.168.1.4           31.12.68.207          TCP      54     49656 > http [ACK] Seq=1 Ack=11080 Win=1505 Len=0

Frame 14: 54 bytes on wire (432 bits), 54 bytes captured (432 bits) on interface 0
Ethernet II, Src: IntelCor_50:de:04 (00:23:15:50:de:04), Dst: Netgear_3b:4d:d2 (4c:60:de:3b:4d:d2)
Internet Protocol Version 4, Src: 192.168.1.4 (192.168.1.4), Dst: 31.12.68.207 (31.12.68.207)
Transmission Control Protocol, Src Port: 49656 (49656), Dst Port: http (80), Seq: 1, Ack: 11080, Len: 0

No.     Time           Source                Destination           Protocol Length Info
     15 0.669939000    31.12.68.207          192.168.1.4           HTTP     462    Continuation or non-HTTP traffic

Frame 15: 462 bytes on wire (3696 bits), 462 bytes captured (3696 bits) on interface 0
Ethernet II, Src: Netgear_3b:4d:d2 (4c:60:de:3b:4d:d2), Dst: IntelCor_50:de:04 (00:23:15:50:de:04)
Internet Protocol Version 4, Src: 31.12.68.207 (31.12.68.207), Dst: 192.168.1.4 (192.168.1.4)
Transmission Control Protocol, Src Port: http (80), Dst Port: 49656 (49656), Seq: 11080, Ack: 1, Len: 408
Hypertext Transfer Protocol

No.     Time           Source                Destination           Protocol Length Info
     16 0.670079000    31.12.68.207          192.168.1.4           HTTP     1514   Continuation or non-HTTP traffic

Frame 16: 1514 bytes on wire (12112 bits), 1514 bytes captured (12112 bits) on interface 0
Ethernet II, Src: Netgear_3b:4d:d2 (4c:60:de:3b:4d:d2), Dst: IntelCor_50:de:04 (00:23:15:50:de:04)
Internet Protocol Version 4, Src: 31.12.68.207 (31.12.68.207), Dst: 192.168.1.4 (192.168.1.4)
Transmission Control Protocol, Src Port: http (80), Dst Port: 49656 (49656), Seq: 11488, Ack: 1, Len: 1460
Hypertext Transfer Protocol

No.     Time           Source                Destination           Protocol Length Info
     17 0.670114000    192.168.1.4           31.12.68.207          TCP      54     49656 > http [ACK] Seq=1 Ack=12948 Win=1497 Len=0

Frame 17: 54 bytes on wire (432 bits), 54 bytes captured (432 bits) on interface 0
Ethernet II, Src: IntelCor_50:de:04 (00:23:15:50:de:04), Dst: Netgear_3b:4d:d2 (4c:60:de:3b:4d:d2)
Internet Protocol Version 4, Src: 192.168.1.4 (192.168.1.4), Dst: 31.12.68.207 (31.12.68.207)
Transmission Control Protocol, Src Port: 49656 (49656), Dst Port: http (80), Seq: 1, Ack: 12948, Len: 0

No.     Time           Source                Destination           Protocol Length Info
     18 0.767463000    31.12.68.207          192.168.1.4           HTTP     695    Continuation or non-HTTP traffic

Frame 18: 695 bytes on wire (5560 bits), 695 bytes captured (5560 bits) on interface 0
Ethernet II, Src: Netgear_3b:4d:d2 (4c:60:de:3b:4d:d2), Dst: IntelCor_50:de:04 (00:23:15:50:de:04)
Internet Protocol Version 4, Src: 31.12.68.207 (31.12.68.207), Dst: 192.168.1.4 (192.168.1.4)
Transmission Control Protocol, Src Port: http (80), Dst Port: 49656 (49656), Seq: 12948, Ack: 1, Len: 641
Hypertext Transfer Protocol

No.     Time           Source                Destination           Protocol Length Info
     19 0.829488000    31.12.68.207          192.168.1.4           HTTP     1514   Continuation or non-HTTP traffic

Frame 19: 1514 bytes on wire (12112 bits), 1514 bytes captured (12112 bits) on interface 0
Ethernet II, Src: Netgear_3b:4d:d2 (4c:60:de:3b:4d:d2), Dst: IntelCor_50:de:04 (00:23:15:50:de:04)
Internet Protocol Version 4, Src: 31.12.68.207 (31.12.68.207), Dst: 192.168.1.4 (192.168.1.4)
Transmission Control Protocol, Src Port: http (80), Dst Port: 49656 (49656), Seq: 13589, Ack: 1, Len: 1460
Hypertext Transfer Protocol

No.     Time           Source                Destination           Protocol Length Info
     20 0.829539000    192.168.1.4           31.12.68.207          TCP      54     49656 > http [ACK] Seq=1 Ack=15049 Win=1489 Len=0

Frame 20: 54 bytes on wire (432 bits), 54 bytes captured (432 bits) on interface 0
Ethernet II, Src: IntelCor_50:de:04 (00:23:15:50:de:04), Dst: Netgear_3b:4d:d2 (4c:60:de:3b:4d:d2)
Internet Protocol Version 4, Src: 192.168.1.4 (192.168.1.4), Dst: 31.12.68.207 (31.12.68.207)
Transmission Control Protocol, Src Port: 49656 (49656), Dst Port: http (80), Seq: 1, Ack: 15049, Len: 0

No.     Time           Source                Destination           Protocol Length Info
     21 0.857024000    173.194.43.54         192.168.1.4           TLSv1    109    Application Data

Frame 21: 109 bytes on wire (872 bits), 109 bytes captured (872 bits) on interface 0
Ethernet II, Src: Netgear_3b:4d:d2 (4c:60:de:3b:4d:d2), Dst: IntelCor_50:de:04 (00:23:15:50:de:04)
Internet Protocol Version 4, Src: 173.194.43.54 (173.194.43.54), Dst: 192.168.1.4 (192.168.1.4)
Transmission Control Protocol, Src Port: https (443), Dst Port: 49170 (49170), Seq: 1, Ack: 1, Len: 55
Secure Sockets Layer

No.     Time           Source                Destination           Protocol Length Info
     22 0.927784000    31.12.68.207          192.168.1.4           HTTP     1102   Continuation or non-HTTP traffic

Frame 22: 1102 bytes on wire (8816 bits), 1102 bytes captured (8816 bits) on interface 0
Ethernet II, Src: Netgear_3b:4d:d2 (4c:60:de:3b:4d:d2), Dst: IntelCor_50:de:04 (00:23:15:50:de:04)
Internet Protocol Version 4, Src: 31.12.68.207 (31.12.68.207), Dst: 192.168.1.4 (192.168.1.4)
Transmission Control Protocol, Src Port: http (80), Dst Port: 49656 (49656), Seq: 15049, Ack: 1, Len: 1048
Hypertext Transfer Protocol

No.     Time           Source                Destination           Protocol Length Info
     23 0.935853000    31.12.68.207          192.168.1.4           HTTP     1514   Continuation or non-HTTP traffic

Frame 23: 1514 bytes on wire (12112 bits), 1514 bytes captured (12112 bits) on interface 0
Ethernet II, Src: Netgear_3b:4d:d2 (4c:60:de:3b:4d:d2), Dst: IntelCor_50:de:04 (00:23:15:50:de:04)
Internet Protocol Version 4, Src: 31.12.68.207 (31.12.68.207), Dst: 192.168.1.4 (192.168.1.4)
Transmission Control Protocol, Src Port: http (80), Dst Port: 49656 (49656), Seq: 16097, Ack: 1, Len: 1460
Hypertext Transfer Protocol

No.     Time           Source                Destination           Protocol Length Info
     24 0.935962000    192.168.1.4           31.12.68.207          TCP      54     49656 > http [ACK] Seq=1 Ack=17557 Win=1479 Len=0

Frame 24: 54 bytes on wire (432 bits), 54 bytes captured (432 bits) on interface 0
Ethernet II, Src: IntelCor_50:de:04 (00:23:15:50:de:04), Dst: Netgear_3b:4d:d2 (4c:60:de:3b:4d:d2)
Internet Protocol Version 4, Src: 192.168.1.4 (192.168.1.4), Dst: 31.12.68.207 (31.12.68.207)
Transmission Control Protocol, Src Port: 49656 (49656), Dst Port: http (80), Seq: 1, Ack: 17557, Len: 0

No.     Time           Source                Destination           Protocol Length Info
     25 1.034360000    31.12.68.207          192.168.1.4           HTTP     1102   Continuation or non-HTTP traffic

Frame 25: 1102 bytes on wire (8816 bits), 1102 bytes captured (8816 bits) on interface 0
Ethernet II, Src: Netgear_3b:4d:d2 (4c:60:de:3b:4d:d2), Dst: IntelCor_50:de:04 (00:23:15:50:de:04)
Internet Protocol Version 4, Src: 31.12.68.207 (31.12.68.207), Dst: 192.168.1.4 (192.168.1.4)
Transmission Control Protocol, Src Port: http (80), Dst Port: 49656 (49656), Seq: 17557, Ack: 1, Len: 1048
Hypertext Transfer Protocol

No.     Time           Source                Destination           Protocol Length Info
     26 1.056955000    192.168.1.4           173.194.43.54         TCP      54     49170 > https [ACK] Seq=1 Ack=56 Win=25967 Len=0

Frame 26: 54 bytes on wire (432 bits), 54 bytes captured (432 bits) on interface 0
Ethernet II, Src: IntelCor_50:de:04 (00:23:15:50:de:04), Dst: Netgear_3b:4d:d2 (4c:60:de:3b:4d:d2)
Internet Protocol Version 4, Src: 192.168.1.4 (192.168.1.4), Dst: 173.194.43.54 (173.194.43.54)
Transmission Control Protocol, Src Port: 49170 (49170), Dst Port: https (443), Seq: 1, Ack: 56, Len: 0

No.     Time           Source                Destination           Protocol Length Info
     27 1.070508000    31.12.68.207          192.168.1.4           HTTP     1514   Continuation or non-HTTP traffic

Frame 27: 1514 bytes on wire (12112 bits), 1514 bytes captured (12112 bits) on interface 0
Ethernet II, Src: Netgear_3b:4d:d2 (4c:60:de:3b:4d:d2), Dst: IntelCor_50:de:04 (00:23:15:50:de:04)
Internet Protocol Version 4, Src: 31.12.68.207 (31.12.68.207), Dst: 192.168.1.4 (192.168.1.4)
Transmission Control Protocol, Src Port: http (80), Dst Port: 49656 (49656), Seq: 18605, Ack: 1, Len: 1460
Hypertext Transfer Protocol

No.     Time           Source                Destination           Protocol Length Info
     28 1.070546000    192.168.1.4           31.12.68.207          TCP      54     49656 > http [ACK] Seq=1 Ack=20065 Win=1470 Len=0

Frame 28: 54 bytes on wire (432 bits), 54 bytes captured (432 bits) on interface 0
Ethernet II, Src: IntelCor_50:de:04 (00:23:15:50:de:04), Dst: Netgear_3b:4d:d2 (4c:60:de:3b:4d:d2)
Internet Protocol Version 4, Src: 192.168.1.4 (192.168.1.4), Dst: 31.12.68.207 (31.12.68.207)
Transmission Control Protocol, Src Port: 49656 (49656), Dst Port: http (80), Seq: 1, Ack: 20065, Len: 0

No.     Time           Source                Destination           Protocol Length Info
     29 1.167807000    31.12.68.207          192.168.1.4           HTTP     1101   Continuation or non-HTTP traffic

Frame 29: 1101 bytes on wire (8808 bits), 1101 bytes captured (8808 bits) on interface 0
Ethernet II, Src: Netgear_3b:4d:d2 (4c:60:de:3b:4d:d2), Dst: IntelCor_50:de:04 (00:23:15:50:de:04)
Internet Protocol Version 4, Src: 31.12.68.207 (31.12.68.207), Dst: 192.168.1.4 (192.168.1.4)
Transmission Control Protocol, Src Port: http (80), Dst Port: 49656 (49656), Seq: 20065, Ack: 1, Len: 1047
Hypertext Transfer Protocol

No.     Time           Source                Destination           Protocol Length Info
     30 1.363013000    192.168.1.4           31.12.68.207          TCP      54     49656 > http [ACK] Seq=1 Ack=21112 Win=1466 Len=0

Frame 30: 54 bytes on wire (432 bits), 54 bytes captured (432 bits) on interface 0
Ethernet II, Src: IntelCor_50:de:04 (00:23:15:50:de:04), Dst: Netgear_3b:4d:d2 (4c:60:de:3b:4d:d2)
Internet Protocol Version 4, Src: 192.168.1.4 (192.168.1.4), Dst: 31.12.68.207 (31.12.68.207)
Transmission Control Protocol, Src Port: 49656 (49656), Dst Port: http (80), Seq: 1, Ack: 21112, Len: 0

No.     Time           Source                Destination           Protocol Length Info
     31 1.371779000    31.12.68.207          192.168.1.4           HTTP     1514   Continuation or non-HTTP traffic

Frame 31: 1514 bytes on wire (12112 bits), 1514 bytes captured (12112 bits) on interface 0
Ethernet II, Src: Netgear_3b:4d:d2 (4c:60:de:3b:4d:d2), Dst: IntelCor_50:de:04 (00:23:15:50:de:04)
Internet Protocol Version 4, Src: 31.12.68.207 (31.12.68.207), Dst: 192.168.1.4 (192.168.1.4)
Transmission Control Protocol, Src Port: http (80), Dst Port: 49656 (49656), Seq: 21112, Ack: 1, Len: 1460
Hypertext Transfer Protocol

No.     Time           Source                Destination           Protocol Length Info
     32 1.461642000    31.12.68.207          192.168.1.4           HTTP     1102   Continuation or non-HTTP traffic

Frame 32: 1102 bytes on wire (8816 bits), 1102 bytes captured (8816 bits) on interface 0
Ethernet II, Src: Netgear_3b:4d:d2 (4c:60:de:3b:4d:d2), Dst: IntelCor_50:de:04 (00:23:15:50:de:04)
Internet Protocol Version 4, Src: 31.12.68.207 (31.12.68.207), Dst: 192.168.1.4 (192.168.1.4)
Transmission Control Protocol, Src Port: http (80), Dst Port: 49656 (49656), Seq: 22572, Ack: 1, Len: 1048
Hypertext Transfer Protocol

No.     Time           Source                Destination           Protocol Length Info
     33 1.461687000    192.168.1.4           31.12.68.207          TCP      54     49656 > http [ACK] Seq=1 Ack=23620 Win=1456 Len=0

Frame 33: 54 bytes on wire (432 bits), 54 bytes captured (432 bits) on interface 0
Ethernet II, Src: IntelCor_50:de:04 (00:23:15:50:de:04), Dst: Netgear_3b:4d:d2 (4c:60:de:3b:4d:d2)
Internet Protocol Version 4, Src: 192.168.1.4 (192.168.1.4), Dst: 31.12.68.207 (31.12.68.207)
Transmission Control Protocol, Src Port: 49656 (49656), Dst Port: http (80), Seq: 1, Ack: 23620, Len: 0

No.     Time           Source                Destination           Protocol Length Info
     34 1.502654000    31.12.68.207          192.168.1.4           HTTP     1514   Continuation or non-HTTP traffic

Frame 34: 1514 bytes on wire (12112 bits), 1514 bytes captured (12112 bits) on interface 0
Ethernet II, Src: Netgear_3b:4d:d2 (4c:60:de:3b:4d:d2), Dst: IntelCor_50:de:04 (00:23:15:50:de:04)
Internet Protocol Version 4, Src: 31.12.68.207 (31.12.68.207), Dst: 192.168.1.4 (192.168.1.4)
Transmission Control Protocol, Src Port: http (80), Dst Port: 49656 (49656), Seq: 23620, Ack: 1, Len: 1460
Hypertext Transfer Protocol

No.     Time           Source                Destination           Protocol Length Info
     35 1.559772000    31.12.68.207          192.168.1.4           HTTP     1102   Continuation or non-HTTP traffic

Frame 35: 1102 bytes on wire (8816 bits), 1102 bytes captured (8816 bits) on interface 0
Ethernet II, Src: Netgear_3b:4d:d2 (4c:60:de:3b:4d:d2), Dst: IntelCor_50:de:04 (00:23:15:50:de:04)
Internet Protocol Version 4, Src: 31.12.68.207 (31.12.68.207), Dst: 192.168.1.4 (192.168.1.4)
Transmission Control Protocol, Src Port: http (80), Dst Port: 49656 (49656), Seq: 25080, Ack: 1, Len: 1048
Hypertext Transfer Protocol

No.     Time           Source                Destination           Protocol Length Info
     36 1.559821000    192.168.1.4           31.12.68.207          TCP      54     49656 > http [ACK] Seq=1 Ack=26128 Win=1446 Len=0

Frame 36: 54 bytes on wire (432 bits), 54 bytes captured (432 bits) on interface 0
Ethernet II, Src: IntelCor_50:de:04 (00:23:15:50:de:04), Dst: Netgear_3b:4d:d2 (4c:60:de:3b:4d:d2)
Internet Protocol Version 4, Src: 192.168.1.4 (192.168.1.4), Dst: 31.12.68.207 (31.12.68.207)
Transmission Control Protocol, Src Port: 49656 (49656), Dst Port: http (80), Seq: 1, Ack: 26128, Len: 0

No.     Time           Source                Destination           Protocol Length Info
     37 1.612005000    31.12.68.207          192.168.1.4           HTTP     1514   Continuation or non-HTTP traffic

Frame 37: 1514 bytes on wire (12112 bits), 1514 bytes captured (12112 bits) on interface 0
Ethernet II, Src: Netgear_3b:4d:d2 (4c:60:de:3b:4d:d2), Dst: IntelCor_50:de:04 (00:23:15:50:de:04)
Internet Protocol Version 4, Src: 31.12.68.207 (31.12.68.207), Dst: 192.168.1.4 (192.168.1.4)
Transmission Control Protocol, Src Port: http (80), Dst Port: 49656 (49656), Seq: 26128, Ack: 1, Len: 1460
Hypertext Transfer Protocol

No.     Time           Source                Destination           Protocol Length Info
     38 1.657627000    31.12.68.207          192.168.1.4           HTTP     1103   Continuation or non-HTTP traffic

Frame 38: 1103 bytes on wire (8824 bits), 1103 bytes captured (8824 bits) on interface 0
Ethernet II, Src: Netgear_3b:4d:d2 (4c:60:de:3b:4d:d2), Dst: IntelCor_50:de:04 (00:23:15:50:de:04)
Internet Protocol Version 4, Src: 31.12.68.207 (31.12.68.207), Dst: 192.168.1.4 (192.168.1.4)
Transmission Control Protocol, Src Port: http (80), Dst Port: 49656 (49656), Seq: 27588, Ack: 1, Len: 1049
Hypertext Transfer Protocol

No.     Time           Source                Destination           Protocol Length Info
     39 1.657662000    192.168.1.4           31.12.68.207          TCP      54     49656 > http [ACK] Seq=1 Ack=28637 Win=1436 Len=0

Frame 39: 54 bytes on wire (432 bits), 54 bytes captured (432 bits) on interface 0
Ethernet II, Src: IntelCor_50:de:04 (00:23:15:50:de:04), Dst: Netgear_3b:4d:d2 (4c:60:de:3b:4d:d2)
Internet Protocol Version 4, Src: 192.168.1.4 (192.168.1.4), Dst: 31.12.68.207 (31.12.68.207)
Transmission Control Protocol, Src Port: 49656 (49656), Dst Port: http (80), Seq: 1, Ack: 28637, Len: 0

No.     Time           Source                Destination           Protocol Length Info
     40 1.788434000    31.12.68.207          192.168.1.4           HTTP     1307   Continuation or non-HTTP traffic

Frame 40: 1307 bytes on wire (10456 bits), 1307 bytes captured (10456 bits) on interface 0
Ethernet II, Src: Netgear_3b:4d:d2 (4c:60:de:3b:4d:d2), Dst: IntelCor_50:de:04 (00:23:15:50:de:04)
Internet Protocol Version 4, Src: 31.12.68.207 (31.12.68.207), Dst: 192.168.1.4 (192.168.1.4)
Transmission Control Protocol, Src Port: http (80), Dst Port: 49656 (49656), Seq: 28637, Ack: 1, Len: 1253
Hypertext Transfer Protocol

No.     Time           Source                Destination           Protocol Length Info
     41 1.991027000    192.168.1.4           31.12.68.207          TCP      54     49656 > http [ACK] Seq=1 Ack=29890 Win=1431 Len=0

Frame 41: 54 bytes on wire (432 bits), 54 bytes captured (432 bits) on interface 0
Ethernet II, Src: IntelCor_50:de:04 (00:23:15:50:de:04), Dst: Netgear_3b:4d:d2 (4c:60:de:3b:4d:d2)
Internet Protocol Version 4, Src: 192.168.1.4 (192.168.1.4), Dst: 31.12.68.207 (31.12.68.207)
Transmission Control Protocol, Src Port: 49656 (49656), Dst Port: http (80), Seq: 1, Ack: 29890, Len: 0

No.     Time           Source                Destination           Protocol Length Info
     42 1.992465000    31.12.68.207          192.168.1.4           HTTP     1514   [TCP Previous segment not captured] Continuation or non-HTTP traffic

Frame 42: 1514 bytes on wire (12112 bits), 1514 bytes captured (12112 bits) on interface 0
Ethernet II, Src: Netgear_3b:4d:d2 (4c:60:de:3b:4d:d2), Dst: IntelCor_50:de:04 (00:23:15:50:de:04)
Internet Protocol Version 4, Src: 31.12.68.207 (31.12.68.207), Dst: 192.168.1.4 (192.168.1.4)
Transmission Control Protocol, Src Port: http (80), Dst Port: 49656 (49656), Seq: 31350, Ack: 1, Len: 1460
Hypertext Transfer Protocol

No.     Time           Source                Destination           Protocol Length Info
     43 1.992502000    192.168.1.4           31.12.68.207          TCP      66     [TCP Dup ACK 41#1] 49656 > http [ACK] Seq=1 Ack=29890 Win=1431 Len=0 SLE=31350 SRE=32810

Frame 43: 66 bytes on wire (528 bits), 66 bytes captured (528 bits) on interface 0
Ethernet II, Src: IntelCor_50:de:04 (00:23:15:50:de:04), Dst: Netgear_3b:4d:d2 (4c:60:de:3b:4d:d2)
Internet Protocol Version 4, Src: 192.168.1.4 (192.168.1.4), Dst: 31.12.68.207 (31.12.68.207)
Transmission Control Protocol, Src Port: 49656 (49656), Dst Port: http (80), Seq: 1, Ack: 29890, Len: 0

No.     Time           Source                Destination           Protocol Length Info
     44 1.992726000    31.12.68.207          192.168.1.4           HTTP     1514   [TCP Out-Of-Order] Continuation or non-HTTP traffic

Frame 44: 1514 bytes on wire (12112 bits), 1514 bytes captured (12112 bits) on interface 0
Ethernet II, Src: Netgear_3b:4d:d2 (4c:60:de:3b:4d:d2), Dst: IntelCor_50:de:04 (00:23:15:50:de:04)
Internet Protocol Version 4, Src: 31.12.68.207 (31.12.68.207), Dst: 192.168.1.4 (192.168.1.4)
Transmission Control Protocol, Src Port: http (80), Dst Port: 49656 (49656), Seq: 29890, Ack: 1, Len: 1460
Hypertext Transfer Protocol

No.     Time           Source                Destination           Protocol Length Info
     45 1.992764000    192.168.1.4           31.12.68.207          TCP      54     49656 > http [ACK] Seq=1 Ack=32810 Win=1420 Len=0

Frame 45: 54 bytes on wire (432 bits), 54 bytes captured (432 bits) on interface 0
Ethernet II, Src: IntelCor_50:de:04 (00:23:15:50:de:04), Dst: Netgear_3b:4d:d2 (4c:60:de:3b:4d:d2)
Internet Protocol Version 4, Src: 192.168.1.4 (192.168.1.4), Dst: 31.12.68.207 (31.12.68.207)
Transmission Control Protocol, Src Port: 49656 (49656), Dst Port: http (80), Seq: 1, Ack: 32810, Len: 0

No.     Time           Source                Destination           Protocol Length Info
     46 2.091548000    31.12.68.207          192.168.1.4           HTTP     896    Continuation or non-HTTP traffic

Frame 46: 896 bytes on wire (7168 bits), 896 bytes captured (7168 bits) on interface 0
Ethernet II, Src: Netgear_3b:4d:d2 (4c:60:de:3b:4d:d2), Dst: IntelCor_50:de:04 (00:23:15:50:de:04)
Internet Protocol Version 4, Src: 31.12.68.207 (31.12.68.207), Dst: 192.168.1.4 (192.168.1.4)
Transmission Control Protocol, Src Port: http (80), Dst Port: 49656 (49656), Seq: 32810, Ack: 1, Len: 842
Hypertext Transfer Protocol

No.     Time           Source                Destination           Protocol Length Info
     47 2.141934000    31.12.68.207          192.168.1.4           HTTP     1514   Continuation or non-HTTP traffic

Frame 47: 1514 bytes on wire (12112 bits), 1514 bytes captured (12112 bits) on interface 0
Ethernet II, Src: Netgear_3b:4d:d2 (4c:60:de:3b:4d:d2), Dst: IntelCor_50:de:04 (00:23:15:50:de:04)
Internet Protocol Version 4, Src: 31.12.68.207 (31.12.68.207), Dst: 192.168.1.4 (192.168.1.4)
Transmission Control Protocol, Src Port: http (80), Dst Port: 49656 (49656), Seq: 33652, Ack: 1, Len: 1460
Hypertext Transfer Protocol

No.     Time           Source                Destination           Protocol Length Info
     48 2.141977000    192.168.1.4           31.12.68.207          TCP      54     49656 > http [ACK] Seq=1 Ack=35112 Win=1411 Len=0

Frame 48: 54 bytes on wire (432 bits), 54 bytes captured (432 bits) on interface 0
Ethernet II, Src: IntelCor_50:de:04 (00:23:15:50:de:04), Dst: Netgear_3b:4d:d2 (4c:60:de:3b:4d:d2)
Internet Protocol Version 4, Src: 192.168.1.4 (192.168.1.4), Dst: 31.12.68.207 (31.12.68.207)
Transmission Control Protocol, Src Port: 49656 (49656), Dst Port: http (80), Seq: 1, Ack: 35112, Len: 0

No.     Time           Source                Destination           Protocol Length Info
     49 2.226013000    31.12.68.207          192.168.1.4           HTTP     1514   Continuation or non-HTTP traffic

Frame 49: 1514 bytes on wire (12112 bits), 1514 bytes captured (12112 bits) on interface 0
Ethernet II, Src: Netgear_3b:4d:d2 (4c:60:de:3b:4d:d2), Dst: IntelCor_50:de:04 (00:23:15:50:de:04)
Internet Protocol Version 4, Src: 31.12.68.207 (31.12.68.207), Dst: 192.168.1.4 (192.168.1.4)
Transmission Control Protocol, Src Port: http (80), Dst Port: 49656 (49656), Seq: 35112, Ack: 1, Len: 1460
Hypertext Transfer Protocol

No.     Time           Source                Destination           Protocol Length Info
     50 2.226248000    31.12.68.207          192.168.1.4           HTTP     1514   Continuation or non-HTTP traffic

Frame 50: 1514 bytes on wire (12112 bits), 1514 bytes captured (12112 bits) on interface 0
Ethernet II, Src: Netgear_3b:4d:d2 (4c:60:de:3b:4d:d2), Dst: IntelCor_50:de:04 (00:23:15:50:de:04)
Internet Protocol Version 4, Src: 31.12.68.207 (31.12.68.207), Dst: 192.168.1.4 (192.168.1.4)
Transmission Control Protocol, Src Port: http (80), Dst Port: 49656 (49656), Seq: 36572, Ack: 1, Len: 1460
Hypertext Transfer Protocol

No.     Time           Source                Destination           Protocol Length Info
     51 2.226281000    192.168.1.4           31.12.68.207          TCP      54     49656 > http [ACK] Seq=1 Ack=38032 Win=1400 Len=0

Frame 51: 54 bytes on wire (432 bits), 54 bytes captured (432 bits) on interface 0
Ethernet II, Src: IntelCor_50:de:04 (00:23:15:50:de:04), Dst: Netgear_3b:4d:d2 (4c:60:de:3b:4d:d2)
Internet Protocol Version 4, Src: 192.168.1.4 (192.168.1.4), Dst: 31.12.68.207 (31.12.68.207)
Transmission Control Protocol, Src Port: 49656 (49656), Dst Port: http (80), Seq: 1, Ack: 38032, Len: 0

No.     Time           Source                Destination           Protocol Length Info
     52 2.239426000    31.12.68.207          192.168.1.4           HTTP     690    Continuation or non-HTTP traffic

Frame 52: 690 bytes on wire (5520 bits), 690 bytes captured (5520 bits) on interface 0
Ethernet II, Src: Netgear_3b:4d:d2 (4c:60:de:3b:4d:d2), Dst: IntelCor_50:de:04 (00:23:15:50:de:04)
Internet Protocol Version 4, Src: 31.12.68.207 (31.12.68.207), Dst: 192.168.1.4 (192.168.1.4)
Transmission Control Protocol, Src Port: http (80), Dst Port: 49656 (49656), Seq: 38032, Ack: 1, Len: 636
Hypertext Transfer Protocol

No.     Time           Source                Destination           Protocol Length Info
     53 2.433738000    31.12.68.207          192.168.1.4           HTTP     1514   Continuation or non-HTTP traffic

Frame 53: 1514 bytes on wire (12112 bits), 1514 bytes captured (12112 bits) on interface 0
Ethernet II, Src: Netgear_3b:4d:d2 (4c:60:de:3b:4d:d2), Dst: IntelCor_50:de:04 (00:23:15:50:de:04)
Internet Protocol Version 4, Src: 31.12.68.207 (31.12.68.207), Dst: 192.168.1.4 (192.168.1.4)
Transmission Control Protocol, Src Port: http (80), Dst Port: 49656 (49656), Seq: 38668, Ack: 1, Len: 1460
Hypertext Transfer Protocol

No.     Time           Source                Destination           Protocol Length Info
     54 2.433798000    192.168.1.4           31.12.68.207          TCP      54     49656 > http [ACK] Seq=1 Ack=40128 Win=1391 Len=0

Frame 54: 54 bytes on wire (432 bits), 54 bytes captured (432 bits) on interface 0
Ethernet II, Src: IntelCor_50:de:04 (00:23:15:50:de:04), Dst: Netgear_3b:4d:d2 (4c:60:de:3b:4d:d2)
Internet Protocol Version 4, Src: 192.168.1.4 (192.168.1.4), Dst: 31.12.68.207 (31.12.68.207)
Transmission Control Protocol, Src Port: 49656 (49656), Dst Port: http (80), Seq: 1, Ack: 40128, Len: 0

No.     Time           Source                Destination           Protocol Length Info
     55 2.521634000    31.12.68.207          192.168.1.4           HTTP     1514   Continuation or non-HTTP traffic

Frame 55: 1514 bytes on wire (12112 bits), 1514 bytes captured (12112 bits) on interface 0
Ethernet II, Src: Netgear_3b:4d:d2 (4c:60:de:3b:4d:d2), Dst: IntelCor_50:de:04 (00:23:15:50:de:04)
Internet Protocol Version 4, Src: 31.12.68.207 (31.12.68.207), Dst: 192.168.1.4 (192.168.1.4)
Transmission Control Protocol, Src Port: http (80), Dst Port: 49656 (49656), Seq: 40128, Ack: 1, Len: 1460
Hypertext Transfer Protocol

No.     Time           Source                Destination           Protocol Length Info
     56 2.522124000    31.12.68.207          192.168.1.4           HTTP     1514   Continuation or non-HTTP traffic

Frame 56: 1514 bytes on wire (12112 bits), 1514 bytes captured (12112 bits) on interface 0
Ethernet II, Src: Netgear_3b:4d:d2 (4c:60:de:3b:4d:d2), Dst: IntelCor_50:de:04 (00:23:15:50:de:04)
Internet Protocol Version 4, Src: 31.12.68.207 (31.12.68.207), Dst: 192.168.1.4 (192.168.1.4)
Transmission Control Protocol, Src Port: http (80), Dst Port: 49656 (49656), Seq: 41588, Ack: 1, Len: 1460
Hypertext Transfer Protocol

No.     Time           Source                Destination           Protocol Length Info
     57 2.522159000    192.168.1.4           31.12.68.207          TCP      54     49656 > http [ACK] Seq=1 Ack=43048 Win=1380 Len=0

Frame 57: 54 bytes on wire (432 bits), 54 bytes captured (432 bits) on interface 0
Ethernet II, Src: IntelCor_50:de:04 (00:23:15:50:de:04), Dst: Netgear_3b:4d:d2 (4c:60:de:3b:4d:d2)
Internet Protocol Version 4, Src: 192.168.1.4 (192.168.1.4), Dst: 31.12.68.207 (31.12.68.207)
Transmission Control Protocol, Src Port: 49656 (49656), Dst Port: http (80), Seq: 1, Ack: 43048, Len: 0

No.     Time           Source                Destination           Protocol Length Info
     58 2.531411000    31.12.68.207          192.168.1.4           HTTP     690    Continuation or non-HTTP traffic

Frame 58: 690 bytes on wire (5520 bits), 690 bytes captured (5520 bits) on interface 0
Ethernet II, Src: Netgear_3b:4d:d2 (4c:60:de:3b:4d:d2), Dst: IntelCor_50:de:04 (00:23:15:50:de:04)
Internet Protocol Version 4, Src: 31.12.68.207 (31.12.68.207), Dst: 192.168.1.4 (192.168.1.4)
Transmission Control Protocol, Src Port: http (80), Dst Port: 49656 (49656), Seq: 43048, Ack: 1, Len: 636
Hypertext Transfer Protocol

No.     Time           Source                Destination           Protocol Length Info
     59 2.697425000    31.12.68.207          192.168.1.4           HTTP     1514   Continuation or non-HTTP traffic

Frame 59: 1514 bytes on wire (12112 bits), 1514 bytes captured (12112 bits) on interface 0
Ethernet II, Src: Netgear_3b:4d:d2 (4c:60:de:3b:4d:d2), Dst: IntelCor_50:de:04 (00:23:15:50:de:04)
Internet Protocol Version 4, Src: 31.12.68.207 (31.12.68.207), Dst: 192.168.1.4 (192.168.1.4)
Transmission Control Protocol, Src Port: http (80), Dst Port: 49656 (49656), Seq: 43684, Ack: 1, Len: 1460
Hypertext Transfer Protocol

No.     Time           Source                Destination           Protocol Length Info
     60 2.697475000    192.168.1.4           31.12.68.207          TCP      54     49656 > http [ACK] Seq=1 Ack=45144 Win=1372 Len=0

Frame 60: 54 bytes on wire (432 bits), 54 bytes captured (432 bits) on interface 0
Ethernet II, Src: IntelCor_50:de:04 (00:23:15:50:de:04), Dst: Netgear_3b:4d:d2 (4c:60:de:3b:4d:d2)
Internet Protocol Version 4, Src: 192.168.1.4 (192.168.1.4), Dst: 31.12.68.207 (31.12.68.207)
Transmission Control Protocol, Src Port: 49656 (49656), Dst Port: http (80), Seq: 1, Ack: 45144, Len: 0

No.     Time           Source                Destination           Protocol Length Info
     61 2.795655000    31.12.68.207          192.168.1.4           HTTP     1102   Continuation or non-HTTP traffic

Frame 61: 1102 bytes on wire (8816 bits), 1102 bytes captured (8816 bits) on interface 0
Ethernet II, Src: Netgear_3b:4d:d2 (4c:60:de:3b:4d:d2), Dst: IntelCor_50:de:04 (00:23:15:50:de:04)
Internet Protocol Version 4, Src: 31.12.68.207 (31.12.68.207), Dst: 192.168.1.4 (192.168.1.4)
Transmission Control Protocol, Src Port: http (80), Dst Port: 49656 (49656), Seq: 45144, Ack: 1, Len: 1048
Hypertext Transfer Protocol

No.     Time           Source                Destination           Protocol Length Info
     62 2.797528000    31.12.68.207          192.168.1.4           HTTP     1514   Continuation or non-HTTP traffic

Frame 62: 1514 bytes on wire (12112 bits), 1514 bytes captured (12112 bits) on interface 0
Ethernet II, Src: Netgear_3b:4d:d2 (4c:60:de:3b:4d:d2), Dst: IntelCor_50:de:04 (00:23:15:50:de:04)
Internet Protocol Version 4, Src: 31.12.68.207 (31.12.68.207), Dst: 192.168.1.4 (192.168.1.4)
Transmission Control Protocol, Src Port: http (80), Dst Port: 49656 (49656), Seq: 46192, Ack: 1, Len: 1460
Hypertext Transfer Protocol

No.     Time           Source                Destination           Protocol Length Info
     63 2.797565000    192.168.1.4           31.12.68.207          TCP      54     49656 > http [ACK] Seq=1 Ack=47652 Win=1362 Len=0

Frame 63: 54 bytes on wire (432 bits), 54 bytes captured (432 bits) on interface 0
Ethernet II, Src: IntelCor_50:de:04 (00:23:15:50:de:04), Dst: Netgear_3b:4d:d2 (4c:60:de:3b:4d:d2)
Internet Protocol Version 4, Src: 192.168.1.4 (192.168.1.4), Dst: 31.12.68.207 (31.12.68.207)
Transmission Control Protocol, Src Port: 49656 (49656), Dst Port: http (80), Seq: 1, Ack: 47652, Len: 0

No.     Time           Source                Destination           Protocol Length Info
     64 2.895644000    31.12.68.207          192.168.1.4           HTTP     1102   Continuation or non-HTTP traffic

Frame 64: 1102 bytes on wire (8816 bits), 1102 bytes captured (8816 bits) on interface 0
Ethernet II, Src: Netgear_3b:4d:d2 (4c:60:de:3b:4d:d2), Dst: IntelCor_50:de:04 (00:23:15:50:de:04)
Internet Protocol Version 4, Src: 31.12.68.207 (31.12.68.207), Dst: 192.168.1.4 (192.168.1.4)
Transmission Control Protocol, Src Port: http (80), Dst Port: 49656 (49656), Seq: 47652, Ack: 1, Len: 1048
Hypertext Transfer Protocol

No.     Time           Source                Destination           Protocol Length Info
     65 2.923310000    31.12.68.207          192.168.1.4           HTTP     1514   Continuation or non-HTTP traffic

Frame 65: 1514 bytes on wire (12112 bits), 1514 bytes captured (12112 bits) on interface 0
Ethernet II, Src: Netgear_3b:4d:d2 (4c:60:de:3b:4d:d2), Dst: IntelCor_50:de:04 (00:23:15:50:de:04)
Internet Protocol Version 4, Src: 31.12.68.207 (31.12.68.207), Dst: 192.168.1.4 (192.168.1.4)
