No.     Time           Source                Destination           Protocol Length Info
      1 0.000000000    31.12.68.207          192.168.1.4           HTTP     1308   Continuation or non-HTTP traffic

Frame 1: 1308 bytes on wire (10464 bits), 1308 bytes captured (10464 bits) on interface 0
Ethernet II, Src: Netgear_3b:4d:d2 (4c:60:de:3b:4d:d2), Dst: IntelCor_50:de:04 (00:23:15:50:de:04)
Internet Protocol Version 4, Src: 31.12.68.207 (31.12.68.207), Dst: 192.168.1.4 (192.168.1.4)
Transmission Control Protocol, Src Port: http (80), Dst Port: 49656 (49656), Seq: 1, Ack: 1, Len: 1254
Hypertext Transfer Protocol

No.     Time           Source                Destination           Protocol Length Info
      2 0.117464000    31.12.68.207          192.168.1.4           HTTP     1514   [TCP Previous segment not captured] Continuation or non-HTTP traffic

Frame 2: 1514 bytes on wire (12112 bits), 1514 bytes captured (12112 bits) on interface 0
Ethernet II, Src: Netgear_3b:4d:d2 (4c:60:de:3b:4d:d2), Dst: IntelCor_50:de:04 (00:23:15:50:de:04)
Internet Protocol Version 4, Src: 31.12.68.207 (31.12.68.207), Dst: 192.168.1.4 (192.168.1.4)
Transmission Control Protocol, Src Port: http (80), Dst Port: 49656 (49656), Seq: 2715, Ack: 1, Len: 1460
Hypertext Transfer Protocol

No.     Time           Source                Destination           Protocol Length Info
      3 0.117515000    192.168.1.4           31.12.68.207          TCP      66     49656 > http [ACK] Seq=1 Ack=1255 Win=830 Len=0 SLE=2715 SRE=4175

Frame 3: 66 bytes on wire (528 bits), 66 bytes captured (528 bits) on interface 0
Ethernet II, Src: IntelCor_50:de:04 (00:23:15:50:de:04), Dst: Netgear_3b:4d:d2 (4c:60:de:3b:4d:d2)
Internet Protocol Version 4, Src: 192.168.1.4 (192.168.1.4), Dst: 31.12.68.207 (31.12.68.207)
Transmission Control Protocol, Src Port: 49656 (49656), Dst Port: http (80), Seq: 1, Ack: 1255, Len: 0

No.     Time           Source                Destination           Protocol Length Info
      4 0.117842000    31.12.68.207          192.168.1.4           HTTP     1514   [TCP Out-Of-Order] Continuation or non-HTTP traffic

Frame 4: 1514 bytes on wire (12112 bits), 1514 bytes captured (12112 bits) on interface 0
Ethernet II, Src: Netgear_3b:4d:d2 (4c:60:de:3b:4d:d2), Dst: IntelCor_50:de:04 (00:23:15:50:de:04)
Internet Protocol Version 4, Src: 31.12.68.207 (31.12.68.207), Dst: 192.168.1.4 (192.168.1.4)
Transmission Control Protocol, Src Port: http (80), Dst Port: 49656 (49656), Seq: 1255, Ack: 1, Len: 1460
Hypertext Transfer Protocol

No.     Time           Source                Destination           Protocol Length Info
      5 0.117885000    192.168.1.4           31.12.68.207          TCP      54     49656 > http [ACK] Seq=1 Ack=4175 Win=818 Len=0

Frame 5: 54 bytes on wire (432 bits), 54 bytes captured (432 bits) on interface 0
Ethernet II, Src: IntelCor_50:de:04 (00:23:15:50:de:04), Dst: Netgear_3b:4d:d2 (4c:60:de:3b:4d:d2)
Internet Protocol Version 4, Src: 192.168.1.4 (192.168.1.4), Dst: 31.12.68.207 (31.12.68.207)
Transmission Control Protocol, Src Port: 49656 (49656), Dst Port: http (80), Seq: 1, Ack: 4175, Len: 0

No.     Time           Source                Destination           Protocol Length Info
      6 0.118739000    31.12.68.207          192.168.1.4           HTTP     1514   [TCP Previous segment not captured] Continuation or non-HTTP traffic

Frame 6: 1514 bytes on wire (12112 bits), 1514 bytes captured (12112 bits) on interface 0
Ethernet II, Src: Netgear_3b:4d:d2 (4c:60:de:3b:4d:d2), Dst: IntelCor_50:de:04 (00:23:15:50:de:04)
Internet Protocol Version 4, Src: 31.12.68.207 (31.12.68.207), Dst: 192.168.1.4 (192.168.1.4)
Transmission Control Protocol, Src Port: http (80), Dst Port: 49656 (49656), Seq: 5635, Ack: 1, Len: 1460
Hypertext Transfer Protocol

No.     Time           Source                Destination           Protocol Length Info
      7 0.118775000    192.168.1.4           31.12.68.207          TCP      66     [TCP Dup ACK 5#1] 49656 > http [ACK] Seq=1 Ack=4175 Win=818 Len=0 SLE=5635 SRE=7095

Frame 7: 66 bytes on wire (528 bits), 66 bytes captured (528 bits) on interface 0
Ethernet II, Src: IntelCor_50:de:04 (00:23:15:50:de:04), Dst: Netgear_3b:4d:d2 (4c:60:de:3b:4d:d2)
Internet Protocol Version 4, Src: 192.168.1.4 (192.168.1.4), Dst: 31.12.68.207 (31.12.68.207)
Transmission Control Protocol, Src Port: 49656 (49656), Dst Port: http (80), Seq: 1, Ack: 4175, Len: 0

No.     Time           Source                Destination           Protocol Length Info
      8 0.118938000    31.12.68.207          192.168.1.4           HTTP     1514   [TCP Out-Of-Order] Continuation or non-HTTP traffic

Frame 8: 1514 bytes on wire (12112 bits), 1514 bytes captured (12112 bits) on interface 0
Ethernet II, Src: Netgear_3b:4d:d2 (4c:60:de:3b:4d:d2), Dst: IntelCor_50:de:04 (00:23:15:50:de:04)
Internet Protocol Version 4, Src: 31.12.68.207 (31.12.68.207), Dst: 192.168.1.4 (192.168.1.4)
Transmission Control Protocol, Src Port: http (80), Dst Port: 49656 (49656), Seq: 4175, Ack: 1, Len: 1460
Hypertext Transfer Protocol

No.     Time           Source                Destination           Protocol Length Info
      9 0.118977000    192.168.1.4           31.12.68.207          TCP      54     49656 > http [ACK] Seq=1 Ack=7095 Win=807 Len=0

Frame 9: 54 bytes on wire (432 bits), 54 bytes captured (432 bits) on interface 0
Ethernet II, Src: IntelCor_50:de:04 (00:23:15:50:de:04), Dst: Netgear_3b:4d:d2 (4c:60:de:3b:4d:d2)
Internet Protocol Version 4, Src: 192.168.1.4 (192.168.1.4), Dst: 31.12.68.207 (31.12.68.207)
Transmission Control Protocol, Src Port: 49656 (49656), Dst Port: http (80), Seq: 1, Ack: 7095, Len: 0

No.     Time           Source                Destination           Protocol Length Info
     10 0.215424000    31.12.68.207          192.168.1.4           HTTP     483    Continuation or non-HTTP traffic

Frame 10: 483 bytes on wire (3864 bits), 483 bytes captured (3864 bits) on interface 0
Ethernet II, Src: Netgear_3b:4d:d2 (4c:60:de:3b:4d:d2), Dst: IntelCor_50:de:04 (00:23:15:50:de:04)
Internet Protocol Version 4, Src: 31.12.68.207 (31.12.68.207), Dst: 192.168.1.4 (192.168.1.4)
Transmission Control Protocol, Src Port: http (80), Dst Port: 49656 (49656), Seq: 7095, Ack: 1, Len: 429
Hypertext Transfer Protocol

No.     Time           Source                Destination           Protocol Length Info
     11 0.415628000    192.168.1.4           31.12.68.207          TCP      54     49656 > http [ACK] Seq=1 Ack=7524 Win=805 Len=0

Frame 11: 54 bytes on wire (432 bits), 54 bytes captured (432 bits) on interface 0
Ethernet II, Src: IntelCor_50:de:04 (00:23:15:50:de:04), Dst: Netgear_3b:4d:d2 (4c:60:de:3b:4d:d2)
Internet Protocol Version 4, Src: 192.168.1.4 (192.168.1.4), Dst: 31.12.68.207 (31.12.68.207)
Transmission Control Protocol, Src Port: 49656 (49656), Dst Port: http (80), Seq: 1, Ack: 7524, Len: 0

No.     Time           Source                Destination           Protocol Length Info
     12 0.509297000    31.12.68.207          192.168.1.4           HTTP     1514   Continuation or non-HTTP traffic

Frame 12: 1514 bytes on wire (12112 bits), 1514 bytes captured (12112 bits) on interface 0
Ethernet II, Src: Netgear_3b:4d:d2 (4c:60:de:3b:4d:d2), Dst: IntelCor_50:de:04 (00:23:15:50:de:04)
Internet Protocol Version 4, Src: 31.12.68.207 (31.12.68.207), Dst: 192.168.1.4 (192.168.1.4)
Transmission Control Protocol, Src Port: http (80), Dst Port: 49656 (49656), Seq: 7524, Ack: 1, Len: 1460
Hypertext Transfer Protocol

No.     Time           Source                Destination           Protocol Length Info
     13 0.513701000    31.12.68.207          192.168.1.4           HTTP     1102   Continuation or non-HTTP traffic

Frame 13: 1102 bytes on wire (8816 bits), 1102 bytes captured (8816 bits) on interface 0
Ethernet II, Src: Netgear_3b:4d:d2 (4c:60:de:3b:4d:d2), Dst: IntelCor_50:de:04 (00:23:15:50:de:04)
Internet Protocol Version 4, Src: 31.12.68.207 (31.12.68.207), Dst: 192.168.1.4 (192.168.1.4)
Transmission Control Protocol, Src Port: http (80), Dst Port: 49656 (49656), Seq: 8984, Ack: 1, Len: 1048
Hypertext Transfer Protocol

No.     Time           Source                Destination           Protocol Length Info
     14 0.513749000    192.168.1.4           31.12.68.207          TCP      54     49656 > http [ACK] Seq=1 Ack=10032 Win=795 Len=0

Frame 14: 54 bytes on wire (432 bits), 54 bytes captured (432 bits) on interface 0
Ethernet II, Src: IntelCor_50:de:04 (00:23:15:50:de:04), Dst: Netgear_3b:4d:d2 (4c:60:de:3b:4d:d2)
Internet Protocol Version 4, Src: 192.168.1.4 (192.168.1.4), Dst: 31.12.68.207 (31.12.68.207)
Transmission Control Protocol, Src Port: 49656 (49656), Dst Port: http (80), Seq: 1, Ack: 10032, Len: 0

No.     Time           Source                Destination           Protocol Length Info
     15 0.647713000    31.12.68.207          192.168.1.4           HTTP     1308   Continuation or non-HTTP traffic

Frame 15: 1308 bytes on wire (10464 bits), 1308 bytes captured (10464 bits) on interface 0
Ethernet II, Src: Netgear_3b:4d:d2 (4c:60:de:3b:4d:d2), Dst: IntelCor_50:de:04 (00:23:15:50:de:04)
Internet Protocol Version 4, Src: 31.12.68.207 (31.12.68.207), Dst: 192.168.1.4 (192.168.1.4)
Transmission Control Protocol, Src Port: http (80), Dst Port: 49656 (49656), Seq: 10032, Ack: 1, Len: 1254
Hypertext Transfer Protocol

No.     Time           Source                Destination           Protocol Length Info
     16 0.648588000    31.12.68.207          192.168.1.4           HTTP     1514   [TCP Previous segment not captured] Continuation or non-HTTP traffic

Frame 16: 1514 bytes on wire (12112 bits), 1514 bytes captured (12112 bits) on interface 0
Ethernet II, Src: Netgear_3b:4d:d2 (4c:60:de:3b:4d:d2), Dst: IntelCor_50:de:04 (00:23:15:50:de:04)
Internet Protocol Version 4, Src: 31.12.68.207 (31.12.68.207), Dst: 192.168.1.4 (192.168.1.4)
Transmission Control Protocol, Src Port: http (80), Dst Port: 49656 (49656), Seq: 12746, Ack: 1, Len: 1460
Hypertext Transfer Protocol

No.     Time           Source                Destination           Protocol Length Info
     17 0.648636000    192.168.1.4           31.12.68.207          TCP      66     49656 > http [ACK] Seq=1 Ack=11286 Win=791 Len=0 SLE=12746 SRE=14206

Frame 17: 66 bytes on wire (528 bits), 66 bytes captured (528 bits) on interface 0
Ethernet II, Src: IntelCor_50:de:04 (00:23:15:50:de:04), Dst: Netgear_3b:4d:d2 (4c:60:de:3b:4d:d2)
Internet Protocol Version 4, Src: 192.168.1.4 (192.168.1.4), Dst: 31.12.68.207 (31.12.68.207)
Transmission Control Protocol, Src Port: 49656 (49656), Dst Port: http (80), Seq: 1, Ack: 11286, Len: 0

No.     Time           Source                Destination           Protocol Length Info
     18 0.649537000    31.12.68.207          192.168.1.4           HTTP     1514   [TCP Out-Of-Order] Continuation or non-HTTP traffic

Frame 18: 1514 bytes on wire (12112 bits), 1514 bytes captured (12112 bits) on interface 0
Ethernet II, Src: Netgear_3b:4d:d2 (4c:60:de:3b:4d:d2), Dst: IntelCor_50:de:04 (00:23:15:50:de:04)
Internet Protocol Version 4, Src: 31.12.68.207 (31.12.68.207), Dst: 192.168.1.4 (192.168.1.4)
Transmission Control Protocol, Src Port: http (80), Dst Port: 49656 (49656), Seq: 11286, Ack: 1, Len: 1460
Hypertext Transfer Protocol

No.     Time           Source                Destination           Protocol Length Info
     19 0.649576000    192.168.1.4           31.12.68.207          TCP      54     49656 > http [ACK] Seq=1 Ack=14206 Win=779 Len=0

Frame 19: 54 bytes on wire (432 bits), 54 bytes captured (432 bits) on interface 0
Ethernet II, Src: IntelCor_50:de:04 (00:23:15:50:de:04), Dst: Netgear_3b:4d:d2 (4c:60:de:3b:4d:d2)
Internet Protocol Version 4, Src: 192.168.1.4 (192.168.1.4), Dst: 31.12.68.207 (31.12.68.207)
Transmission Control Protocol, Src Port: 49656 (49656), Dst Port: http (80), Seq: 1, Ack: 14206, Len: 0

No.     Time           Source                Destination           Protocol Length Info
     20 0.747596000    31.12.68.207          192.168.1.4           HTTP     896    Continuation or non-HTTP traffic

Frame 20: 896 bytes on wire (7168 bits), 896 bytes captured (7168 bits) on interface 0
Ethernet II, Src: Netgear_3b:4d:d2 (4c:60:de:3b:4d:d2), Dst: IntelCor_50:de:04 (00:23:15:50:de:04)
Internet Protocol Version 4, Src: 31.12.68.207 (31.12.68.207), Dst: 192.168.1.4 (192.168.1.4)
Transmission Control Protocol, Src Port: http (80), Dst Port: 49656 (49656), Seq: 14206, Ack: 1, Len: 842
Hypertext Transfer Protocol

No.     Time           Source                Destination           Protocol Length Info
     21 0.806300000    31.12.68.207          192.168.1.4           HTTP     1514   Continuation or non-HTTP traffic

Frame 21: 1514 bytes on wire (12112 bits), 1514 bytes captured (12112 bits) on interface 0
Ethernet II, Src: Netgear_3b:4d:d2 (4c:60:de:3b:4d:d2), Dst: IntelCor_50:de:04 (00:23:15:50:de:04)
Internet Protocol Version 4, Src: 31.12.68.207 (31.12.68.207), Dst: 192.168.1.4 (192.168.1.4)
Transmission Control Protocol, Src Port: http (80), Dst Port: 49656 (49656), Seq: 15048, Ack: 1, Len: 1460
Hypertext Transfer Protocol

No.     Time           Source                Destination           Protocol Length Info
     22 0.806346000    192.168.1.4           31.12.68.207          TCP      54     49656 > http [ACK] Seq=1 Ack=16508 Win=770 Len=0

Frame 22: 54 bytes on wire (432 bits), 54 bytes captured (432 bits) on interface 0
Ethernet II, Src: IntelCor_50:de:04 (00:23:15:50:de:04), Dst: Netgear_3b:4d:d2 (4c:60:de:3b:4d:d2)
Internet Protocol Version 4, Src: 192.168.1.4 (192.168.1.4), Dst: 31.12.68.207 (31.12.68.207)
Transmission Control Protocol, Src Port: 49656 (49656), Dst Port: http (80), Seq: 1, Ack: 16508, Len: 0

No.     Time           Source                Destination           Protocol Length Info
     23 0.876744000    192.168.1.4           31.12.68.207          TCP      54     [TCP Window Update] 49656 > http [ACK] Seq=1 Ack=16508 Win=1127 Len=0

Frame 23: 54 bytes on wire (432 bits), 54 bytes captured (432 bits) on interface 0
Ethernet II, Src: IntelCor_50:de:04 (00:23:15:50:de:04), Dst: Netgear_3b:4d:d2 (4c:60:de:3b:4d:d2)
Internet Protocol Version 4, Src: 192.168.1.4 (192.168.1.4), Dst: 31.12.68.207 (31.12.68.207)
Transmission Control Protocol, Src Port: 49656 (49656), Dst Port: http (80), Seq: 1, Ack: 16508, Len: 0

No.     Time           Source                Destination           Protocol Length Info
     24 0.905238000    31.12.68.207          192.168.1.4           HTTP     1102   Continuation or non-HTTP traffic

Frame 24: 1102 bytes on wire (8816 bits), 1102 bytes captured (8816 bits) on interface 0
Ethernet II, Src: Netgear_3b:4d:d2 (4c:60:de:3b:4d:d2), Dst: IntelCor_50:de:04 (00:23:15:50:de:04)
Internet Protocol Version 4, Src: 31.12.68.207 (31.12.68.207), Dst: 192.168.1.4 (192.168.1.4)
Transmission Control Protocol, Src Port: http (80), Dst Port: 49656 (49656), Seq: 16508, Ack: 1, Len: 1048
Hypertext Transfer Protocol

No.     Time           Source                Destination           Protocol Length Info
     25 0.985510000    31.12.68.207          192.168.1.4           HTTP     1514   Continuation or non-HTTP traffic

Frame 25: 1514 bytes on wire (12112 bits), 1514 bytes captured (12112 bits) on interface 0
Ethernet II, Src: Netgear_3b:4d:d2 (4c:60:de:3b:4d:d2), Dst: IntelCor_50:de:04 (00:23:15:50:de:04)
Internet Protocol Version 4, Src: 31.12.68.207 (31.12.68.207), Dst: 192.168.1.4 (192.168.1.4)
Transmission Control Protocol, Src Port: http (80), Dst Port: 49656 (49656), Seq: 17556, Ack: 1, Len: 1460
Hypertext Transfer Protocol

No.     Time           Source                Destination           Protocol Length Info
     26 0.985563000    192.168.1.4           31.12.68.207          TCP      54     49656 > http [ACK] Seq=1 Ack=19016 Win=1117 Len=0

Frame 26: 54 bytes on wire (432 bits), 54 bytes captured (432 bits) on interface 0
Ethernet II, Src: IntelCor_50:de:04 (00:23:15:50:de:04), Dst: Netgear_3b:4d:d2 (4c:60:de:3b:4d:d2)
Internet Protocol Version 4, Src: 192.168.1.4 (192.168.1.4), Dst: 31.12.68.207 (31.12.68.207)
Transmission Control Protocol, Src Port: 49656 (49656), Dst Port: http (80), Seq: 1, Ack: 19016, Len: 0

No.     Time           Source                Destination           Protocol Length Info
     27 1.085663000    31.12.68.207          192.168.1.4           HTTP     1102   Continuation or non-HTTP traffic

Frame 27: 1102 bytes on wire (8816 bits), 1102 bytes captured (8816 bits) on interface 0
Ethernet II, Src: Netgear_3b:4d:d2 (4c:60:de:3b:4d:d2), Dst: IntelCor_50:de:04 (00:23:15:50:de:04)
Internet Protocol Version 4, Src: 31.12.68.207 (31.12.68.207), Dst: 192.168.1.4 (192.168.1.4)
Transmission Control Protocol, Src Port: http (80), Dst Port: 49656 (49656), Seq: 19016, Ack: 1, Len: 1048
Hypertext Transfer Protocol

No.     Time           Source                Destination           Protocol Length Info
     28 1.288488000    192.168.1.4           31.12.68.207          TCP      54     49656 > http [ACK] Seq=1 Ack=20064 Win=1113 Len=0

Frame 28: 54 bytes on wire (432 bits), 54 bytes captured (432 bits) on interface 0
Ethernet II, Src: IntelCor_50:de:04 (00:23:15:50:de:04), Dst: Netgear_3b:4d:d2 (4c:60:de:3b:4d:d2)
Internet Protocol Version 4, Src: 192.168.1.4 (192.168.1.4), Dst: 31.12.68.207 (31.12.68.207)
Transmission Control Protocol, Src Port: 49656 (49656), Dst Port: http (80), Seq: 1, Ack: 20064, Len: 0

No.     Time           Source                Destination           Protocol Length Info
     29 1.304245000    31.12.68.207          192.168.1.4           HTTP     1514   Continuation or non-HTTP traffic

Frame 29: 1514 bytes on wire (12112 bits), 1514 bytes captured (12112 bits) on interface 0
Ethernet II, Src: Netgear_3b:4d:d2 (4c:60:de:3b:4d:d2), Dst: IntelCor_50:de:04 (00:23:15:50:de:04)
Internet Protocol Version 4, Src: 31.12.68.207 (31.12.68.207), Dst: 192.168.1.4 (192.168.1.4)
Transmission Control Protocol, Src Port: http (80), Dst Port: 49656 (49656), Seq: 20064, Ack: 1, Len: 1460
Hypertext Transfer Protocol

No.     Time           Source                Destination           Protocol Length Info
     30 1.386028000    31.12.68.207          192.168.1.4           HTTP     1102   Continuation or non-HTTP traffic

Frame 30: 1102 bytes on wire (8816 bits), 1102 bytes captured (8816 bits) on interface 0
Ethernet II, Src: Netgear_3b:4d:d2 (4c:60:de:3b:4d:d2), Dst: IntelCor_50:de:04 (00:23:15:50:de:04)
Internet Protocol Version 4, Src: 31.12.68.207 (31.12.68.207), Dst: 192.168.1.4 (192.168.1.4)
Transmission Control Protocol, Src Port: http (80), Dst Port: 49656 (49656), Seq: 21524, Ack: 1, Len: 1048
Hypertext Transfer Protocol

No.     Time           Source                Destination           Protocol Length Info
     31 1.386100000    192.168.1.4           31.12.68.207          TCP      54     49656 > http [ACK] Seq=1 Ack=22572 Win=1103 Len=0

Frame 31: 54 bytes on wire (432 bits), 54 bytes captured (432 bits) on interface 0
Ethernet II, Src: IntelCor_50:de:04 (00:23:15:50:de:04), Dst: Netgear_3b:4d:d2 (4c:60:de:3b:4d:d2)
Internet Protocol Version 4, Src: 192.168.1.4 (192.168.1.4), Dst: 31.12.68.207 (31.12.68.207)
Transmission Control Protocol, Src Port: 49656 (49656), Dst Port: http (80), Seq: 1, Ack: 22572, Len: 0

No.     Time           Source                Destination           Protocol Length Info
     32 1.470569000    31.12.68.207          192.168.1.4           HTTP     1514   Continuation or non-HTTP traffic

Frame 32: 1514 bytes on wire (12112 bits), 1514 bytes captured (12112 bits) on interface 0
Ethernet II, Src: Netgear_3b:4d:d2 (4c:60:de:3b:4d:d2), Dst: IntelCor_50:de:04 (00:23:15:50:de:04)
Internet Protocol Version 4, Src: 31.12.68.207 (31.12.68.207), Dst: 192.168.1.4 (192.168.1.4)
Transmission Control Protocol, Src Port: http (80), Dst Port: 49656 (49656), Seq: 22572, Ack: 1, Len: 1460
Hypertext Transfer Protocol

No.     Time           Source                Destination           Protocol Length Info
     33 1.483750000    31.12.68.207          192.168.1.4           HTTP     1101   Continuation or non-HTTP traffic

Frame 33: 1101 bytes on wire (8808 bits), 1101 bytes captured (8808 bits) on interface 0
Ethernet II, Src: Netgear_3b:4d:d2 (4c:60:de:3b:4d:d2), Dst: IntelCor_50:de:04 (00:23:15:50:de:04)
Internet Protocol Version 4, Src: 31.12.68.207 (31.12.68.207), Dst: 192.168.1.4 (192.168.1.4)
Transmission Control Protocol, Src Port: http (80), Dst Port: 49656 (49656), Seq: 24032, Ack: 1, Len: 1047
Hypertext Transfer Protocol

No.     Time           Source                Destination           Protocol Length Info
     34 1.483785000    192.168.1.4           31.12.68.207          TCP      54     49656 > http [ACK] Seq=1 Ack=25079 Win=1093 Len=0

Frame 34: 54 bytes on wire (432 bits), 54 bytes captured (432 bits) on interface 0
Ethernet II, Src: IntelCor_50:de:04 (00:23:15:50:de:04), Dst: Netgear_3b:4d:d2 (4c:60:de:3b:4d:d2)
Internet Protocol Version 4, Src: 192.168.1.4 (192.168.1.4), Dst: 31.12.68.207 (31.12.68.207)
Transmission Control Protocol, Src Port: 49656 (49656), Dst Port: http (80), Seq: 1, Ack: 25079, Len: 0

No.     Time           Source                Destination           Protocol Length Info
     35 1.606006000    31.12.68.207          192.168.1.4           HTTP     1308   Continuation or non-HTTP traffic

Frame 35: 1308 bytes on wire (10464 bits), 1308 bytes captured (10464 bits) on interface 0
Ethernet II, Src: Netgear_3b:4d:d2 (4c:60:de:3b:4d:d2), Dst: IntelCor_50:de:04 (00:23:15:50:de:04)
Internet Protocol Version 4, Src: 31.12.68.207 (31.12.68.207), Dst: 192.168.1.4 (192.168.1.4)
Transmission Control Protocol, Src Port: http (80), Dst Port: 49656 (49656), Seq: 25079, Ack: 1, Len: 1254
Hypertext Transfer Protocol

No.     Time           Source                Destination           Protocol Length Info
     36 1.606404000    31.12.68.207          192.168.1.4           HTTP     1514   [TCP Previous segment not captured] Continuation or non-HTTP traffic

Frame 36: 1514 bytes on wire (12112 bits), 1514 bytes captured (12112 bits) on interface 0
Ethernet II, Src: Netgear_3b:4d:d2 (4c:60:de:3b:4d:d2), Dst: IntelCor_50:de:04 (00:23:15:50:de:04)
Internet Protocol Version 4, Src: 31.12.68.207 (31.12.68.207), Dst: 192.168.1.4 (192.168.1.4)
Transmission Control Protocol, Src Port: http (80), Dst Port: 49656 (49656), Seq: 27793, Ack: 1, Len: 1460
Hypertext Transfer Protocol

No.     Time           Source                Destination           Protocol Length Info
     37 1.606442000    192.168.1.4           31.12.68.207          TCP      66     49656 > http [ACK] Seq=1 Ack=26333 Win=1089 Len=0 SLE=27793 SRE=29253

Frame 37: 66 bytes on wire (528 bits), 66 bytes captured (528 bits) on interface 0
Ethernet II, Src: IntelCor_50:de:04 (00:23:15:50:de:04), Dst: Netgear_3b:4d:d2 (4c:60:de:3b:4d:d2)
Internet Protocol Version 4, Src: 192.168.1.4 (192.168.1.4), Dst: 31.12.68.207 (31.12.68.207)
Transmission Control Protocol, Src Port: 49656 (49656), Dst Port: http (80), Seq: 1, Ack: 26333, Len: 0

No.     Time           Source                Destination           Protocol Length Info
     38 1.606843000    31.12.68.207          192.168.1.4           HTTP     1514   [TCP Out-Of-Order] Continuation or non-HTTP traffic

Frame 38: 1514 bytes on wire (12112 bits), 1514 bytes captured (12112 bits) on interface 0
Ethernet II, Src: Netgear_3b:4d:d2 (4c:60:de:3b:4d:d2), Dst: IntelCor_50:de:04 (00:23:15:50:de:04)
Internet Protocol Version 4, Src: 31.12.68.207 (31.12.68.207), Dst: 192.168.1.4 (192.168.1.4)
Transmission Control Protocol, Src Port: http (80), Dst Port: 49656 (49656), Seq: 26333, Ack: 1, Len: 1460
Hypertext Transfer Protocol

No.     Time           Source                Destination           Protocol Length Info
     39 1.606881000    192.168.1.4           31.12.68.207          TCP      54     49656 > http [ACK] Seq=1 Ack=29253 Win=1077 Len=0

Frame 39: 54 bytes on wire (432 bits), 54 bytes captured (432 bits) on interface 0
Ethernet II, Src: IntelCor_50:de:04 (00:23:15:50:de:04), Dst: Netgear_3b:4d:d2 (4c:60:de:3b:4d:d2)
Internet Protocol Version 4, Src: 192.168.1.4 (192.168.1.4), Dst: 31.12.68.207 (31.12.68.207)
Transmission Control Protocol, Src Port: 49656 (49656), Dst Port: http (80), Seq: 1, Ack: 29253, Len: 0

No.     Time           Source                Destination           Protocol Length Info
     40 1.705610000    31.12.68.207          192.168.1.4           HTTP     897    Continuation or non-HTTP traffic

Frame 40: 897 bytes on wire (7176 bits), 897 bytes captured (7176 bits) on interface 0
Ethernet II, Src: Netgear_3b:4d:d2 (4c:60:de:3b:4d:d2), Dst: IntelCor_50:de:04 (00:23:15:50:de:04)
Internet Protocol Version 4, Src: 31.12.68.207 (31.12.68.207), Dst: 192.168.1.4 (192.168.1.4)
Transmission Control Protocol, Src Port: http (80), Dst Port: 49656 (49656), Seq: 29253, Ack: 1, Len: 843
Hypertext Transfer Protocol

No.     Time           Source                Destination           Protocol Length Info
     41 1.727467000    31.12.68.207          192.168.1.4           HTTP     1514   Continuation or non-HTTP traffic

Frame 41: 1514 bytes on wire (12112 bits), 1514 bytes captured (12112 bits) on interface 0
Ethernet II, Src: Netgear_3b:4d:d2 (4c:60:de:3b:4d:d2), Dst: IntelCor_50:de:04 (00:23:15:50:de:04)
Internet Protocol Version 4, Src: 31.12.68.207 (31.12.68.207), Dst: 192.168.1.4 (192.168.1.4)
Transmission Control Protocol, Src Port: http (80), Dst Port: 49656 (49656), Seq: 30096, Ack: 1, Len: 1460
Hypertext Transfer Protocol

No.     Time           Source                Destination           Protocol Length Info
     42 1.727524000    192.168.1.4           31.12.68.207          TCP      54     49656 > http [ACK] Seq=1 Ack=31556 Win=1068 Len=0

Frame 42: 54 bytes on wire (432 bits), 54 bytes captured (432 bits) on interface 0
Ethernet II, Src: IntelCor_50:de:04 (00:23:15:50:de:04), Dst: Netgear_3b:4d:d2 (4c:60:de:3b:4d:d2)
Internet Protocol Version 4, Src: 192.168.1.4 (192.168.1.4), Dst: 31.12.68.207 (31.12.68.207)
Transmission Control Protocol, Src Port: 49656 (49656), Dst Port: http (80), Seq: 1, Ack: 31556, Len: 0

No.     Time           Source                Destination           Protocol Length Info
     43 1.825655000    31.12.68.207          192.168.1.4           HTTP     1102   Continuation or non-HTTP traffic

Frame 43: 1102 bytes on wire (8816 bits), 1102 bytes captured (8816 bits) on interface 0
Ethernet II, Src: Netgear_3b:4d:d2 (4c:60:de:3b:4d:d2), Dst: IntelCor_50:de:04 (00:23:15:50:de:04)
Internet Protocol Version 4, Src: 31.12.68.207 (31.12.68.207), Dst: 192.168.1.4 (192.168.1.4)
Transmission Control Protocol, Src Port: http (80), Dst Port: 49656 (49656), Seq: 31556, Ack: 1, Len: 1048
Hypertext Transfer Protocol

No.     Time           Source                Destination           Protocol Length Info
     44 1.891599000    31.12.68.207          192.168.1.4           HTTP     1514   Continuation or non-HTTP traffic

Frame 44: 1514 bytes on wire (12112 bits), 1514 bytes captured (12112 bits) on interface 0
Ethernet II, Src: Netgear_3b:4d:d2 (4c:60:de:3b:4d:d2), Dst: IntelCor_50:de:04 (00:23:15:50:de:04)
Internet Protocol Version 4, Src: 31.12.68.207 (31.12.68.207), Dst: 192.168.1.4 (192.168.1.4)
Transmission Control Protocol, Src Port: http (80), Dst Port: 49656 (49656), Seq: 32604, Ack: 1, Len: 1460
Hypertext Transfer Protocol

No.     Time           Source                Destination           Protocol Length Info
     45 1.891640000    192.168.1.4           31.12.68.207          TCP      54     49656 > http [ACK] Seq=1 Ack=34064 Win=1058 Len=0

Frame 45: 54 bytes on wire (432 bits), 54 bytes captured (432 bits) on interface 0
Ethernet II, Src: IntelCor_50:de:04 (00:23:15:50:de:04), Dst: Netgear_3b:4d:d2 (4c:60:de:3b:4d:d2)
Internet Protocol Version 4, Src: 192.168.1.4 (192.168.1.4), Dst: 31.12.68.207 (31.12.68.207)
Transmission Control Protocol, Src Port: 49656 (49656), Dst Port: http (80), Seq: 1, Ack: 34064, Len: 0

No.     Time           Source                Destination           Protocol Length Info
     46 1.989699000    31.12.68.207          192.168.1.4           HTTP     1101   Continuation or non-HTTP traffic

Frame 46: 1101 bytes on wire (8808 bits), 1101 bytes captured (8808 bits) on interface 0
Ethernet II, Src: Netgear_3b:4d:d2 (4c:60:de:3b:4d:d2), Dst: IntelCor_50:de:04 (00:23:15:50:de:04)
Internet Protocol Version 4, Src: 31.12.68.207 (31.12.68.207), Dst: 192.168.1.4 (192.168.1.4)
Transmission Control Protocol, Src Port: http (80), Dst Port: 49656 (49656), Seq: 34064, Ack: 1, Len: 1047
Hypertext Transfer Protocol

No.     Time           Source                Destination           Protocol Length Info
     47 2.035758000    31.12.68.207          192.168.1.4           HTTP     1514   Continuation or non-HTTP traffic

Frame 47: 1514 bytes on wire (12112 bits), 1514 bytes captured (12112 bits) on interface 0
Ethernet II, Src: Netgear_3b:4d:d2 (4c:60:de:3b:4d:d2), Dst: IntelCor_50:de:04 (00:23:15:50:de:04)
Internet Protocol Version 4, Src: 31.12.68.207 (31.12.68.207), Dst: 192.168.1.4 (192.168.1.4)
Transmission Control Protocol, Src Port: http (80), Dst Port: 49656 (49656), Seq: 35111, Ack: 1, Len: 1460
Hypertext Transfer Protocol

No.     Time           Source                Destination           Protocol Length Info
     48 2.035853000    192.168.1.4           31.12.68.207          TCP      54     49656 > http [ACK] Seq=1 Ack=36571 Win=1049 Len=0

Frame 48: 54 bytes on wire (432 bits), 54 bytes captured (432 bits) on interface 0
Ethernet II, Src: IntelCor_50:de:04 (00:23:15:50:de:04), Dst: Netgear_3b:4d:d2 (4c:60:de:3b:4d:d2)
Internet Protocol Version 4, Src: 192.168.1.4 (192.168.1.4), Dst: 31.12.68.207 (31.12.68.207)
Transmission Control Protocol, Src Port: 49656 (49656), Dst Port: http (80), Seq: 1, Ack: 36571, Len: 0

No.     Time           Source                Destination           Protocol Length Info
     49 2.133774000    31.12.68.207          192.168.1.4           HTTP     1102   Continuation or non-HTTP traffic

Frame 49: 1102 bytes on wire (8816 bits), 1102 bytes captured (8816 bits) on interface 0
Ethernet II, Src: Netgear_3b:4d:d2 (4c:60:de:3b:4d:d2), Dst: IntelCor_50:de:04 (00:23:15:50:de:04)
Internet Protocol Version 4, Src: 31.12.68.207 (31.12.68.207), Dst: 192.168.1.4 (192.168.1.4)
Transmission Control Protocol, Src Port: http (80), Dst Port: 49656 (49656), Seq: 36571, Ack: 1, Len: 1048
Hypertext Transfer Protocol

No.     Time           Source                Destination           Protocol Length Info
     50 2.288242000    192.168.1.4           173.194.43.54         TCP      1484   [TCP segment of a reassembled PDU]

Frame 50: 1484 bytes on wire (11872 bits), 1484 bytes captured (11872 bits) on interface 0
Ethernet II, Src: IntelCor_50:de:04 (00:23:15:50:de:04), Dst: Netgear_3b:4d:d2 (4c:60:de:3b:4d:d2)
Internet Protocol Version 4, Src: 192.168.1.4 (192.168.1.4), Dst: 173.194.43.54 (173.194.43.54)
Transmission Control Protocol, Src Port: 49170 (49170), Dst Port: https (443), Seq: 1, Ack: 1, Len: 1430

No.     Time           Source                Destination           Protocol Length Info
     51 2.288254000    192.168.1.4           173.194.43.54         TLSv1    923    Application Data

Frame 51: 923 bytes on wire (7384 bits), 923 bytes captured (7384 bits) on interface 0
Ethernet II, Src: IntelCor_50:de:04 (00:23:15:50:de:04), Dst: Netgear_3b:4d:d2 (4c:60:de:3b:4d:d2)
Internet Protocol Version 4, Src: 192.168.1.4 (192.168.1.4), Dst: 173.194.43.54 (173.194.43.54)
Transmission Control Protocol, Src Port: 49170 (49170), Dst Port: https (443), Seq: 1431, Ack: 1, Len: 869
[2 Reassembled TCP Segments (2299 bytes): #50(1430), #51(869)]
Secure Sockets Layer

No.     Time           Source                Destination           Protocol Length Info
     52 2.288543000    192.168.1.4           173.194.43.54         TLSv1    163    Application Data

Frame 52: 163 bytes on wire (1304 bits), 163 bytes captured (1304 bits) on interface 0
Ethernet II, Src: IntelCor_50:de:04 (00:23:15:50:de:04), Dst: Netgear_3b:4d:d2 (4c:60:de:3b:4d:d2)
Internet Protocol Version 4, Src: 192.168.1.4 (192.168.1.4), Dst: 173.194.43.54 (173.194.43.54)
Transmission Control Protocol, Src Port: 49170 (49170), Dst Port: https (443), Seq: 2300, Ack: 1, Len: 109
Secure Sockets Layer

No.     Time           Source                Destination           Protocol Length Info
     53 2.314637000    173.194.43.54         192.168.1.4           TCP      54     https > 49170 [ACK] Seq=1 Ack=1431 Win=1906 Len=0

Frame 53: 54 bytes on wire (432 bits), 54 bytes captured (432 bits) on interface 0
Ethernet II, Src: Netgear_3b:4d:d2 (4c:60:de:3b:4d:d2), Dst: IntelCor_50:de:04 (00:23:15:50:de:04)
Internet Protocol Version 4, Src: 173.194.43.54 (173.194.43.54), Dst: 192.168.1.4 (192.168.1.4)
Transmission Control Protocol, Src Port: https (443), Dst Port: 49170 (49170), Seq: 1, Ack: 1431, Len: 0

No.     Time           Source                Destination           Protocol Length Info
     54 2.320004000    173.194.43.54         192.168.1.4           TCP      54     https > 49170 [ACK] Seq=1 Ack=2300 Win=1906 Len=0

Frame 54: 54 bytes on wire (432 bits), 54 bytes captured (432 bits) on interface 0
Ethernet II, Src: Netgear_3b:4d:d2 (4c:60:de:3b:4d:d2), Dst: IntelCor_50:de:04 (00:23:15:50:de:04)
Internet Protocol Version 4, Src: 173.194.43.54 (173.194.43.54), Dst: 192.168.1.4 (192.168.1.4)
Transmission Control Protocol, Src Port: https (443), Dst Port: 49170 (49170), Seq: 1, Ack: 2300, Len: 0

No.     Time           Source                Destination           Protocol Length Info
     55 2.320053000    173.194.43.54         192.168.1.4           TCP      54     https > 49170 [ACK] Seq=1 Ack=2409 Win=1906 Len=0

Frame 55: 54 bytes on wire (432 bits), 54 bytes captured (432 bits) on interface 0
Ethernet II, Src: Netgear_3b:4d:d2 (4c:60:de:3b:4d:d2), Dst: IntelCor_50:de:04 (00:23:15:50:de:04)
Internet Protocol Version 4, Src: 173.194.43.54 (173.194.43.54), Dst: 192.168.1.4 (192.168.1.4)
Transmission Control Protocol, Src Port: https (443), Dst Port: 49170 (49170), Seq: 1, Ack: 2409, Len: 0

No.     Time           Source                Destination           Protocol Length Info
     56 2.333066000    31.12.68.207          192.168.1.4           HTTP     1514   Continuation or non-HTTP traffic

Frame 56: 1514 bytes on wire (12112 bits), 1514 bytes captured (12112 bits) on interface 0
Ethernet II, Src: Netgear_3b:4d:d2 (4c:60:de:3b:4d:d2), Dst: IntelCor_50:de:04 (00:23:15:50:de:04)
Internet Protocol Version 4, Src: 31.12.68.207 (31.12.68.207), Dst: 192.168.1.4 (192.168.1.4)
Transmission Control Protocol, Src Port: http (80), Dst Port: 49656 (49656), Seq: 37619, Ack: 1, Len: 1460
Hypertext Transfer Protocol

No.     Time           Source                Destination           Protocol Length Info
     57 2.333105000    192.168.1.4           31.12.68.207          TCP      54     49656 > http [ACK] Seq=1 Ack=39079 Win=1039 Len=0

Frame 57: 54 bytes on wire (432 bits), 54 bytes captured (432 bits) on interface 0
Ethernet II, Src: IntelCor_50:de:04 (00:23:15:50:de:04), Dst: Netgear_3b:4d:d2 (4c:60:de:3b:4d:d2)
Internet Protocol Version 4, Src: 192.168.1.4 (192.168.1.4), Dst: 31.12.68.207 (31.12.68.207)
Transmission Control Protocol, Src Port: 49656 (49656), Dst Port: http (80), Seq: 1, Ack: 39079, Len: 0

No.     Time           Source                Destination           Protocol Length Info
     58 2.431905000    31.12.68.207          192.168.1.4           HTTP     1102   Continuation or non-HTTP traffic

Frame 58: 1102 bytes on wire (8816 bits), 1102 bytes captured (8816 bits) on interface 0
Ethernet II, Src: Netgear_3b:4d:d2 (4c:60:de:3b:4d:d2), Dst: IntelCor_50:de:04 (00:23:15:50:de:04)
Internet Protocol Version 4, Src: 31.12.68.207 (31.12.68.207), Dst: 192.168.1.4 (192.168.1.4)
Transmission Control Protocol, Src Port: http (80), Dst Port: 49656 (49656), Seq: 39079, Ack: 1, Len: 1048
Hypertext Transfer Protocol

No.     Time           Source                Destination           Protocol Length Info
     59 2.435848000    173.194.43.54         192.168.1.4           TLSv1    105    Application Data

Frame 59: 105 bytes on wire (840 bits), 105 bytes captured (840 bits) on interface 0
Ethernet II, Src: Netgear_3b:4d:d2 (4c:60:de:3b:4d:d2), Dst: IntelCor_50:de:04 (00:23:15:50:de:04)
Internet Protocol Version 4, Src: 173.194.43.54 (173.194.43.54), Dst: 192.168.1.4 (192.168.1.4)
Transmission Control Protocol, Src Port: https (443), Dst Port: 49170 (49170), Seq: 1, Ack: 2409, Len: 51
Secure Sockets Layer

No.     Time           Source                Destination           Protocol Length Info
     60 2.435969000    173.194.43.54         192.168.1.4           TLSv1    97     Application Data

Frame 60: 97 bytes on wire (776 bits), 97 bytes captured (776 bits) on interface 0
Ethernet II, Src: Netgear_3b:4d:d2 (4c:60:de:3b:4d:d2), Dst: IntelCor_50:de:04 (00:23:15:50:de:04)
Internet Protocol Version 4, Src: 173.194.43.54 (173.194.43.54), Dst: 192.168.1.4 (192.168.1.4)
Transmission Control Protocol, Src Port: https (443), Dst Port: 49170 (49170), Seq: 52, Ack: 2409, Len: 43
Secure Sockets Layer

No.     Time           Source                Destination           Protocol Length Info
     61 2.435997000    192.168.1.4           173.194.43.54         TCP      54     49170 > https [ACK] Seq=2409 Ack=95 Win=26060 Len=0

Frame 61: 54 bytes on wire (432 bits), 54 bytes captured (432 bits) on interface 0
Ethernet II, Src: IntelCor_50:de:04 (00:23:15:50:de:04), Dst: Netgear_3b:4d:d2 (4c:60:de:3b:4d:d2)
Internet Protocol Version 4, Src: 192.168.1.4 (192.168.1.4), Dst: 173.194.43.54 (173.194.43.54)
Transmission Control Protocol, Src Port: 49170 (49170), Dst Port: https (443), Seq: 2409, Ack: 95, Len: 0

No.     Time           Source                Destination           Protocol Length Info
     62 2.436707000    173.194.43.54         192.168.1.4           TLSv1    110    Application Data

Frame 62: 110 bytes on wire (880 bits), 110 bytes captured (880 bits) on interface 0
Ethernet II, Src: Netgear_3b:4d:d2 (4c:60:de:3b:4d:d2), Dst: IntelCor_50:de:04 (00:23:15:50:de:04)
Internet Protocol Version 4, Src: 173.194.43.54 (173.194.43.54), Dst: 192.168.1.4 (192.168.1.4)
Transmission Control Protocol, Src Port: https (443), Dst Port: 49170 (49170), Seq: 95, Ack: 2409, Len: 56
Secure Sockets Layer

No.     Time           Source                Destination           Protocol Length Info
     63 2.446407000    31.12.68.207          192.168.1.4           HTTP     1514   Continuation or non-HTTP traffic

Frame 63: 1514 bytes on wire (12112 bits), 1514 bytes captured (12112 bits) on interface 0
Ethernet II, Src: Netgear_3b:4d:d2 (4c:60:de:3b:4d:d2), Dst: IntelCor_50:de:04 (00:23:15:50:de:04)
Internet Protocol Version 4, Src: 31.12.68.207 (31.12.68.207), Dst: 192.168.1.4 (192.168.1.4)
Transmission Control Protocol, Src Port: http (80), Dst Port: 49656 (49656), Seq: 40127, Ack: 1, Len: 1460
Hypertext Transfer Protocol

No.     Time           Source                Destination           Protocol Length Info
     64 2.446446000    192.168.1.4           31.12.68.207          TCP      54     49656 > http [ACK] Seq=1 Ack=41587 Win=1029 Len=0

Frame 64: 54 bytes on wire (432 bits), 54 bytes captured (432 bits) on interface 0
Ethernet II, Src: IntelCor_50:de:04 (00:23:15:50:de:04), Dst: Netgear_3b:4d:d2 (4c:60:de:3b:4d:d2)
Internet Protocol Version 4, Src: 192.168.1.4 (192.168.1.4), Dst: 31.12.68.207 (31.12.68.207)
Transmission Control Protocol, Src Port: 49656 (49656), Dst Port: http (80), Seq: 1, Ack: 41587, Len: 0

No.     Time           Source                Destination           Protocol Length Info
     65 2.541644000    31.12.68.207          192.168.1.4           HTTP     1514   Continuation or non-HTTP traffic

Frame 65: 1514 bytes on wire (12112 bits), 1514 bytes captured (12112 bits) on interface 0
Ethernet II, Src: Netgear_3b:4d:d2 (4c:60:de:3b:4d:d2), Dst: IntelCor_50:de:04 (00:23:15:50:de:04)
Internet Protocol Version 4, Src: 31.12.68.207 (31.12.68.207), Dst: 192.168.1.4 (192.168.1.4)
Transmission Control Protocol, Src Port: http (80), Dst Port: 49656 (49656), Seq: 41587, Ack: 1, Len: 1460
Hypertext Transfer Protocol

No.     Time           Source                Destination           Protocol Length Info
     66 2.541925000    31.12.68.207          192.168.1.4           HTTP     1514   Continuation or non-HTTP traffic

Frame 66: 1514 bytes on wire (12112 bits), 1514 bytes captured (12112 bits) on interface 0
Ethernet II, Src: Netgear_3b:4d:d2 (4c:60:de:3b:4d:d2), Dst: IntelCor_50:de:04 (00:23:15:50:de:04)
Internet Protocol Version 4, Src: 31.12.68.207 (31.12.68.207), Dst: 192.168.1.4 (192.168.1.4)
Transmission Control Protocol, Src Port: http (80), Dst Port: 49656 (49656), Seq: 43047, Ack: 1, Len: 1460
Hypertext Transfer Protocol

No.     Time           Source                Destination           Protocol Length Info
     67 2.541991000    192.168.1.4           31.12.68.207          TCP      54     49656 > http [ACK] Seq=1 Ack=44507 Win=1018 Len=0

Frame 67: 54 bytes on wire (432 bits), 54 bytes captured (432 bits) on interface 0
Ethernet II, Src: IntelCor_50:de:04 (00:23:15:50:de:04), Dst: Netgear_3b:4d:d2 (4c:60:de:3b:4d:d2)
Internet Protocol Version 4, Src: 192.168.1.4 (192.168.1.4), Dst: 31.12.68.207 (31.12.68.207)
Transmission Control Protocol, Src Port: 49656 (49656), Dst Port: http (80), Seq: 1, Ack: 44507, Len: 0

No.     Time           Source                Destination           Protocol Length Info
     68 2.545312000    31.12.68.207          192.168.1.4           HTTP     690    Continuation or non-HTTP traffic

Frame 68: 690 bytes on wire (5520 bits), 690 bytes captured (5520 bits) on interface 0
Ethernet II, Src: Netgear_3b:4d:d2 (4c:60:de:3b:4d:d2), Dst: IntelCor_50:de:04 (00:23:15:50:de:04)
Internet Protocol Version 4, Src: 31.12.68.207 (31.12.68.207), Dst: 192.168.1.4 (192.168.1.4)
Transmission Control Protocol, Src Port: http (80), Dst Port: 49656 (49656), Seq: 44507, Ack: 1, Len: 636
Hypertext Transfer Protocol

No.     Time           Source                Destination           Protocol Length Info
     69 2.625417000    31.12.68.207          192.168.1.4           HTTP     1514   Continuation or non-HTTP traffic

Frame 69: 1514 bytes on wire (12112 bits), 1514 bytes captured (12112 bits) on interface 0
Ethernet II, Src: Netgear_3b:4d:d2 (4c:60:de:3b:4d:d2), Dst: IntelCor_50:de:04 (00:23:15:50:de:04)
Internet Protocol Version 4, Src: 31.12.68.207 (31.12.68.207), Dst: 192.168.1.4 (192.168.1.4)
Transmission Control Protocol, Src Port: http (80), Dst Port: 49656 (49656), Seq: 45143, Ack: 1, Len: 1460
Hypertext Transfer Protocol

No.     Time           Source                Destination           Protocol Length Info
     70 2.625475000    192.168.1.4           31.12.68.207          TCP      54     49656 > http [ACK] Seq=1 Ack=46603 Win=1009 Len=0

Frame 70: 54 bytes on wire (432 bits), 54 bytes captured (432 bits) on interface 0
Ethernet II, Src: IntelCor_50:de:04 (00:23:15:50:de:04), Dst: Netgear_3b:4d:d2 (4c:60:de:3b:4d:d2)
Internet Protocol Version 4, Src: 192.168.1.4 (192.168.1.4), Dst: 31.12.68.207 (31.12.68.207)
Transmission Control Protocol, Src Port: 49656 (49656), Dst Port: http (80), Seq: 1, Ack: 46603, Len: 0

No.     Time           Source                Destination           Protocol Length Info
     71 2.637571000    192.168.1.4           173.194.43.54         TCP      54     49170 > https [ACK] Seq=2409 Ack=151 Win=26046 Len=0

Frame 71: 54 bytes on wire (432 bits), 54 bytes captured (432 bits) on interface 0
Ethernet II, Src: IntelCor_50:de:04 (00:23:15:50:de:04), Dst: Netgear_3b:4d:d2 (4c:60:de:3b:4d:d2)
Internet Protocol Version 4, Src: 192.168.1.4 (192.168.1.4), Dst: 173.194.43.54 (173.194.43.54)
Transmission Control Protocol, Src Port: 49170 (49170), Dst Port: https (443), Seq: 2409, Ack: 151, Len: 0

No.     Time           Source                Destination           Protocol Length Info
     72 2.725583000    31.12.68.207          192.168.1.4           HTTP     1102   Continuation or non-HTTP traffic

Frame 72: 1102 bytes on wire (8816 bits), 1102 bytes captured (8816 bits) on interface 0
Ethernet II, Src: Netgear_3b:4d:d2 (4c:60:de:3b:4d:d2), Dst: IntelCor_50:de:04 (00:23:15:50:de:04)
Internet Protocol Version 4, Src: 31.12.68.207 (31.12.68.207), Dst: 192.168.1.4 (192.168.1.4)
Transmission Control Protocol, Src Port: http (80), Dst Port: 49656 (49656), Seq: 46603, Ack: 1, Len: 1048
Hypertext Transfer Protocol

No.     Time           Source                Destination           Protocol Length Info
     73 2.877359000    31.12.68.207          192.168.1.4           HTTP     1514   Continuation or non-HTTP traffic

Frame 73: 1514 bytes on wire (12112 bits), 1514 bytes captured (12112 bits) on interface 0
Ethernet II, Src: Netgear_3b:4d:d2 (4c:60:de:3b:4d:d2), Dst: IntelCor_50:de:04 (00:23:15:50:de:04)
Internet Protocol Version 4, Src: 31.12.68.207 (31.12.68.207), Dst: 192.168.1.4 (192.168.1.4)
Transmission Control Protocol, Src Port: http (80), Dst Port: 49656 (49656), Seq: 47651, Ack: 1, Len: 1460
Hypertext Transfer Protocol

No.     Time           Source                Destination           Protocol Length Info
     74 2.877413000    192.168.1.4           31.12.68.207          TCP      54     49656 > http [ACK] Seq=1 Ack=49111 Win=1000 Len=0

Frame 74: 54 bytes on wire (432 bits), 54 bytes captured (432 bits) on interface 0
Ethernet II, Src: IntelCor_50:de:04 (00:23:15:50:de:04), Dst: Netgear_3b:4d:d2 (4c:60:de:3b:4d:d2)
Internet Protocol Version 4, Src: 192.168.1.4 (192.168.1.4), Dst: 31.12.68.207 (31.12.68.207)
Transmission Control Protocol, Src Port: 49656 (49656), Dst Port: http (80), Seq: 1, Ack: 49111, Len: 0

No.     Time           Source                Destination           Protocol Length Info
     75 2.975592000    31.12.68.207          192.168.1.4           HTTP     1102   Continuation or non-HTTP traffic

Frame 75: 1102 bytes on wire (8816 bits), 1102 bytes captured (8816 bits) on interface 0
Ethernet II, Src: Netgear_3b:4d:d2 (4c:60:de:3b:4d:d2), Dst: IntelCor_50:de:04 (00:23:15:50:de:04)
Internet Protocol Version 4, Src: 31.12.68.207 (31.12.68.207), Dst: 192.168.1.4 (192.168.1.4)
Transmission Control Protocol, Src Port: http (80), Dst Port: 49656 (49656), Seq: 49111, Ack: 1, Len: 1048
Hypertext Transfer Protocol

No.     Time           Source                Destination           Protocol Length Info
     76 2.995256000    31.12.68.207          192.168.1.4           HTTP     1514   Continuation or non-HTTP traffic

Frame 76: 1514 bytes on wire (12112 bits), 1514 bytes captured (12112 bits) on interface 0
Ethernet II, Src: Netgear_3b:4d:d2 (4c:60:de:3b:4d:d2), Dst: IntelCor_50:de:04 (00:23:15:50:de:04)
Internet Protocol Version 4, Src: 31.12.68.207 (31.12.68.207), Dst: 192.168.1.4 (192.168.1.4)
Transmission Control Protocol, Src Port: http (80), Dst Port: 49656 (49656), Seq: 50159, Ack: 1, Len: 1460
Hypertext Transfer Protocol

No.     Time           Source                Destination           Protocol Length Info
     77 2.995294000    192.168.1.4           31.12.68.207          TCP      54     49656 > http [ACK] Seq=1 Ack=51619 Win=990 Len=0

Frame 77: 54 bytes on wire (432 bits), 54 bytes captured (432 bits) on interface 0
Ethernet II, Src: IntelCor_50:de:04 (00:23:15:50:de:04), Dst: Netgear_3b:4d:d2 (4c:60:de:3b:4d:d2)
Internet Protocol Version 4, Src: 192.168.1.4 (192.168.1.4), Dst: 31.12.68.207 (31.12.68.207)
Transmission Control Protocol, Src Port: 49656 (49656), Dst Port: http (80), Seq: 1, Ack: 51619, Len: 0

No.     Time           Source                Destination           Protocol Length Info
     78 3.093514000    31.12.68.207          192.168.1.4           HTTP     1102   Continuation or non-HTTP traffic

Frame 78: 1102 bytes on wire (8816 bits), 1102 bytes captured (8816 bits) on interface 0
Ethernet II, Src: Netgear_3b:4d:d2 (4c:60:de:3b:4d:d2), Dst: IntelCor_50:de:04 (00:23:15:50:de:04)
Internet Protocol Version 4, Src: 31.12.68.207 (31.12.68.207), Dst: 192.168.1.4 (192.168.1.4)
Transmission Control Protocol, Src Port: http (80), Dst Port: 49656 (49656), Seq: 51619, Ack: 1, Len: 1048
Hypertext Transfer Protocol

No.     Time           Source                Destination           Protocol Length Info
     79 3.105869000    31.12.68.207          192.168.1.4           HTTP     1514   Continuation or non-HTTP traffic

Frame 79: 1514 bytes on wire (12112 bits), 1514 bytes captured (12112 bits) on interface 0
Ethernet II, Src: Netgear_3b:4d:d2 (4c:60:de:3b:4d:d2), Dst: IntelCor_50:de:04 (00:23:15:50:de:04)
Internet Protocol Version 4, Src: 31.12.68.207 (31.12.68.207), Dst: 192.168.1.4 (192.168.1.4)
Transmission Control Protocol, Src Port: http (80), Dst Port: 49656 (49656), Seq: 52667, Ack: 1, Len: 1460
Hypertext Transfer Protocol

No.     Time           Source                Destination           Protocol Length Info
     80 3.105905000    192.168.1.4           31.12.68.207          TCP      54     49656 > http [ACK] Seq=1 Ack=54127 Win=980 Len=0

Frame 80: 54 bytes on wire (432 bits), 54 bytes captured (432 bits) on interface 0
Ethernet II, Src: IntelCor_50:de:04 (00:23:15:50:de:04), Dst: Netgear_3b:4d:d2 (4c:60:de:3b:4d:d2)
Internet Protocol Version 4, Src: 192.168.1.4 (192.168.1.4), Dst: 31.12.68.207 (31.12.68.207)
Transmission Control Protocol, Src Port: 49656 (49656), Dst Port: http (80), Seq: 1, Ack: 54127, Len: 0

No.     Time           Source                Destination           Protocol Length Info
     81 3.205964000    31.12.68.207          192.168.1.4           HTTP     1101   Continuation or non-HTTP traffic

Frame 81: 1101 bytes on wire (8808 bits), 1101 bytes captured (8808 bits) on interface 0
Ethernet II, Src: Netgear_3b:4d:d2 (4c:60:de:3b:4d:d2), Dst: IntelCor_50:de:04 (00:23:15:50:de:04)
Internet Protocol Version 4, Src: 31.12.68.207 (31.12.68.207), Dst: 192.168.1.4 (192.168.1.4)
Transmission Control Protocol, Src Port: http (80), Dst Port: 49656 (49656), Seq: 54127, Ack: 1, Len: 1047
Hypertext Transfer Protocol

No.     Time           Source                Destination           Protocol Length Info
     82 3.243034000    31.12.68.207          192.168.1.4           HTTP     1514   Continuation or non-HTTP traffic

Frame 82: 1514 bytes on wire (12112 bits), 1514 bytes captured (12112 bits) on interface 0
Ethernet II, Src: Netgear_3b:4d:d2 (4c:60:de:3b:4d:d2), Dst: IntelCor_50:de:04 (00:23:15:50:de:04)
Internet Protocol Version 4, Src: 31.12.68.207 (31.12.68.207), Dst: 192.168.1.4 (192.168.1.4)
Transmission Control Protocol, Src Port: http (80), Dst Port: 49656 (49656), Seq: 55174, Ack: 1, Len: 1460
Hypertext Transfer Protocol

No.     Time           Source                Destination           Protocol Length Info
     83 3.243068000    192.168.1.4           31.12.68.207          TCP      54     49656 > http [ACK] Seq=1 Ack=56634 Win=970 Len=0

Frame 83: 54 bytes on wire (432 bits), 54 bytes captured (432 bits) on interface 0
Ethernet II, Src: IntelCor_50:de:04 (00:23:15:50:de:04), Dst: Netgear_3b:4d:d2 (4c:60:de:3b:4d:d2)
Internet Protocol Version 4, Src: 192.168.1.4 (192.168.1.4), Dst: 31.12.68.207 (31.12.68.207)
Transmission Control Protocol, Src Port: 49656 (49656), Dst Port: http (80), Seq: 1, Ack: 56634, Len: 0

No.     Time           Source                Destination           Protocol Length Info
     84 3.342227000    31.12.68.207          192.168.1.4           HTTP     1102   Continuation or non-HTTP traffic

Frame 84: 1102 bytes on wire (8816 bits), 1102 bytes captured (8816 bits) on interface 0
Ethernet II, Src: Netgear_3b:4d:d2 (4c:60:de:3b:4d:d2), Dst: IntelCor_50:de:04 (00:23:15:50:de:04)
Internet Protocol Version 4, Src: 31.12.68.207 (31.12.68.207), Dst: 192.168.1.4 (192.168.1.4)
Transmission Control Protocol, Src Port: http (80), Dst Port: 49656 (49656), Seq: 56634, Ack: 1, Len: 1048
Hypertext Transfer Protocol

No.     Time           Source                Destination           Protocol Length Info
     85 3.541819000    31.12.68.207          192.168.1.4           HTTP     1514   Continuation or non-HTTP traffic

Frame 85: 1514 bytes on wire (12112 bits), 1514 bytes captured (12112 bits) on interface 0
Ethernet II, Src: Netgear_3b:4d:d2 (4c:60:de:3b:4d:d2), Dst: IntelCor_50:de:04 (00:23:15:50:de:04)
Internet Protocol Version 4, Src: 31.12.68.207 (31.12.68.207), Dst: 192.168.1.4 (192.168.1.4)
Transmission Control Protocol, Src Port: http (80), Dst Port: 49656 (49656), Seq: 57682, Ack: 1, Len: 1460
Hypertext Transfer Protocol

No.     Time           Source                Destination           Protocol Length Info
     86 3.541878000    192.168.1.4           31.12.68.207          TCP      54     49656 > http [ACK] Seq=1 Ack=59142 Win=960 Len=0

Frame 86: 54 bytes on wire (432 bits), 54 bytes captured (432 bits) on interface 0
Ethernet II, Src: IntelCor_50:de:04 (00:23:15:50:de:04), Dst: Netgear_3b:4d:d2 (4c:60:de:3b:4d:d2)
Internet Protocol Version 4, Src: 192.168.1.4 (192.168.1.4), Dst: 31.12.68.207 (31.12.68.207)
Transmission Control Protocol, Src Port: 49656 (49656), Dst Port: http (80), Seq: 1, Ack: 59142, Len: 0

No.     Time           Source                Destination           Protocol Length Info
     87 3.639575000    31.12.68.207          192.168.1.4           HTTP     1102   Continuation or non-HTTP traffic

Frame 87: 1102 bytes on wire (8816 bits), 1102 bytes captured (8816 bits) on interface 0
Ethernet II, Src: Netgear_3b:4d:d2 (4c:60:de:3b:4d:d2), Dst: IntelCor_50:de:04 (00:23:15:50:de:04)
Internet Protocol Version 4, Src: 31.12.68.207 (31.12.68.207), Dst: 192.168.1.4 (192.168.1.4)
Transmission Control Protocol, Src Port: http (80), Dst Port: 49656 (49656), Seq: 59142, Ack: 1, Len: 1048
Hypertext Transfer Protocol

No.     Time           Source                Destination           Protocol Length Info
     88 3.672651000    31.12.68.207          192.168.1.4           HTTP     1514   Continuation or non-HTTP traffic

Frame 88: 1514 bytes on wire (12112 bits), 1514 bytes captured (12112 bits) on interface 0
Ethernet II, Src: Netgear_3b:4d:d2 (4c:60:de:3b:4d:d2), Dst: IntelCor_50:de:04 (00:23:15:50:de:04)
Internet Protocol Version 4, Src: 31.12.68.207 (31.12.68.207), Dst: 192.168.1.4 (192.168.1.4)
Transmission Control Protocol, Src Port: http (80), Dst Port: 49656 (49656), Seq: 60190, Ack: 1, Len: 1460
Hypertext Transfer Protocol

No.     Time           Source                Destination           Protocol Length Info
     89 3.672695000    192.168.1.4           31.12.68.207          TCP      54     49656 > http [ACK] Seq=1 Ack=61650 Win=951 Len=0

Frame 89: 54 bytes on wire (432 bits), 54 bytes captured (432 bits) on interface 0
Ethernet II, Src: IntelCor_50:de:04 (00:23:15:50:de:04), Dst: Netgear_3b:4d:d2 (4c:60:de:3b:4d:d2)
Internet Protocol Version 4, Src: 192.168.1.4 (192.168.1.4), Dst: 31.12.68.207 (31.12.68.207)
Transmission Control Protocol, Src Port: 49656 (49656), Dst Port: http (80), Seq: 1, Ack: 61650, Len: 0

No.     Time           Source                Destination           Protocol Length Info
     90 3.771684000    31.12.68.207          192.168.1.4           HTTP     1103   Continuation or non-HTTP traffic

Frame 90: 1103 bytes on wire (8824 bits), 1103 bytes captured (8824 bits) on interface 0
Ethernet II, Src: Netgear_3b:4d:d2 (4c:60:de:3b:4d:d2), Dst: IntelCor_50:de:04 (00:23:15:50:de:04)
Internet Protocol Version 4, Src: 31.12.68.207 (31.12.68.207), Dst: 192.168.1.4 (192.168.1.4)
Transmission Control Protocol, Src Port: http (80), Dst Port: 49656 (49656), Seq: 61650, Ack: 1, Len: 1049
Hypertext Transfer Protocol

No.     Time           Source                Destination           Protocol Length Info
     91 3.830103000    31.12.68.207          192.168.1.4           HTTP     1514   Continuation or non-HTTP traffic

Frame 91: 1514 bytes on wire (12112 bits), 1514 bytes captured (12112 bits) on interface 0
Ethernet II, Src: Netgear_3b:4d:d2 (4c:60:de:3b:4d:d2), Dst: IntelCor_50:de:04 (00:23:15:50:de:04)
Internet Protocol Version 4, Src: 31.12.68.207 (31.12.68.207), Dst: 192.168.1.4 (192.168.1.4)
Transmission Control Protocol, Src Port: http (80), Dst Port: 49656 (49656), Seq: 62699, Ack: 1, Len: 1460
Hypertext Transfer Protocol

No.     Time           Source                Destination           Protocol Length Info
     92 3.830146000    192.168.1.4           31.12.68.207          TCP      54     49656 > http [ACK] Seq=1 Ack=64159 Win=941 Len=0

Frame 92: 54 bytes on wire (432 bits), 54 bytes captured (432 bits) on interface 0
Ethernet II, Src: IntelCor_50:de:04 (00:23:15:50:de:04), Dst: Netgear_3b:4d:d2 (4c:60:de:3b:4d:d2)
Internet Protocol Version 4, Src: 192.168.1.4 (192.168.1.4), Dst: 31.12.68.207 (31.12.68.207)
Transmission Control Protocol, Src Port: 49656 (49656), Dst Port: http (80), Seq: 1, Ack: 64159, Len: 0

No.     Time           Source                Destination           Protocol Length Info
     93 3.927579000    31.12.68.207          192.168.1.4           HTTP     1101   Continuation or non-HTTP traffic

Frame 93: 1101 bytes on wire (8808 bits), 1101 bytes captured (8808 bits) on interface 0
Ethernet II, Src: Netgear_3b:4d:d2 (4c:60:de:3b:4d:d2), Dst: IntelCor_50:de:04 (00:23:15:50:de:04)
Internet Protocol Version 4, Src: 31.12.68.207 (31.12.68.207), Dst: 192.168.1.4 (192.168.1.4)
Transmission Control Protocol, Src Port: http (80), Dst Port: 49656 (49656), Seq: 64159, Ack: 1, Len: 1047
Hypertext Transfer Protocol

No.     Time           Source                Destination           Protocol Length Info
     94 3.957047000    31.12.68.207          192.168.1.4           HTTP     1514   Continuation or non-HTTP traffic

Frame 94: 1514 bytes on wire (12112 bits), 1514 bytes captured (12112 bits) on interface 0
Ethernet II, Src: Netgear_3b:4d:d2 (4c:60:de:3b:4d:d2), Dst: IntelCor_50:de:04 (00:23:15:50:de:04)
Internet Protocol Version 4, Src: 31.12.68.207 (31.12.68.207), Dst: 192.168.1.4 (192.168.1.4)
Transmission Control Protocol, Src Port: http (80), Dst Port: 49656 (49656), Seq: 65206, Ack: 1, Len: 1460
Hypertext Transfer Protocol

No.     Time           Source                Destination           Protocol Length Info
     95 3.957093000    192.168.1.4           31.12.68.207          TCP      54     49656 > http [ACK] Seq=1 Ack=66666 Win=931 Len=0

Frame 95: 54 bytes on wire (432 bits), 54 bytes captured (432 bits) on interface 0
Ethernet II, Src: IntelCor_50:de:04 (00:23:15:50:de:04), Dst: Netgear_3b:4d:d2 (4c:60:de:3b:4d:d2)
Internet Protocol Version 4, Src: 192.168.1.4 (192.168.1.4), Dst: 31.12.68.207 (31.12.68.207)
Transmission Control Protocol, Src Port: 49656 (49656), Dst Port: http (80), Seq: 1, Ack: 66666, Len: 0

No.     Time           Source                Destination           Protocol Length Info
     96 4.055584000    31.12.68.207          192.168.1.4           HTTP     1102   Continuation or non-HTTP traffic

Frame 96: 1102 bytes on wire (8816 bits), 1102 bytes captured (8816 bits) on interface 0
Ethernet II, Src: Netgear_3b:4d:d2 (4c:60:de:3b:4d:d2), Dst: IntelCor_50:de:04 (00:23:15:50:de:04)
Internet Protocol Version 4, Src: 31.12.68.207 (31.12.68.207), Dst: 192.168.1.4 (192.168.1.4)
Transmission Control Protocol, Src Port: http (80), Dst Port: 49656 (49656), Seq: 66666, Ack: 1, Len: 1048
Hypertext Transfer Protocol

No.     Time           Source                Destination           Protocol Length Info
     97 4.164207000    31.12.68.207          192.168.1.4           HTTP     1514   Continuation or non-HTTP traffic

Frame 97: 1514 bytes on wire (12112 bits), 1514 bytes captured (12112 bits) on interface 0
Ethernet II, Src: Netgear_3b:4d:d2 (4c:60:de:3b:4d:d2), Dst: IntelCor_50:de:04 (00:23:15:50:de:04)
Internet Protocol Version 4, Src: 31.12.68.207 (31.12.68.207), Dst: 192.168.1.4 (192.168.1.4)
Transmission Control Protocol, Src Port: http (80), Dst Port: 49656 (49656), Seq: 67714, Ack: 1, Len: 1460
Hypertext Transfer Protocol

No.     Time           Source                Destination           Protocol Length Info
     98 4.164249000    192.168.1.4           31.12.68.207          TCP      54     49656 > http [ACK] Seq=1 Ack=69174 Win=921 Len=0

Frame 98: 54 bytes on wire (432 bits), 54 bytes captured (432 bits) on interface 0
Ethernet II, Src: IntelCor_50:de:04 (00:23:15:50:de:04), Dst: Netgear_3b:4d:d2 (4c:60:de:3b:4d:d2)
Internet Protocol Version 4, Src: 192.168.1.4 (192.168.1.4), Dst: 31.12.68.207 (31.12.68.207)
Transmission Control Protocol, Src Port: 49656 (49656), Dst Port: http (80), Seq: 1, Ack: 69174, Len: 0

No.     Time           Source                Destination           Protocol Length Info
     99 4.261066000    31.12.68.207          192.168.1.4           HTTP     1514   [TCP Previous segment not captured] Continuation or non-HTTP traffic

Frame 99: 1514 bytes on wire (12112 bits), 1514 bytes captured (12112 bits) on interface 0
Ethernet II, Src: Netgear_3b:4d:d2 (4c:60:de:3b:4d:d2), Dst: IntelCor_50:de:04 (00:23:15:50:de:04)
Internet Protocol Version 4, Src: 31.12.68.207 (31.12.68.207), Dst: 192.168.1.4 (192.168.1.4)
Transmission Control Protocol, Src Port: http (80), Dst Port: 49656 (49656), Seq: 70634, Ack: 1, Len: 1460
Hypertext Transfer Protocol

No.     Time           Source                Destination           Protocol Length Info
    100 4.261123000    192.168.1.4           31.12.68.207          TCP      66     [TCP Dup ACK 98#1] 49656 > http [ACK] Seq=1 Ack=69174 Win=921 Len=0 SLE=70634 SRE=72094

Frame 100: 66 bytes on wire (528 bits), 66 bytes captured (528 bits) on interface 0
Ethernet II, Src: IntelCor_50:de:04 (00:23:15:50:de:04), Dst: Netgear_3b:4d:d2 (4c:60:de:3b:4d:d2)
Internet Protocol Version 4, Src: 192.168.1.4 (192.168.1.4), Dst: 31.12.68.207 (31.12.68.207)
Transmission Control Protocol, Src Port: 49656 (49656), Dst Port: http (80), Seq: 1, Ack: 69174, Len: 0

No.     Time           Source                Destination           Protocol Length Info
    101 4.261502000    31.12.68.207          192.168.1.4           HTTP     1514   [TCP Out-Of-Order] Continuation or non-HTTP traffic

Frame 101: 1514 bytes on wire (12112 bits), 1514 bytes captured (12112 bits) on interface 0
Ethernet II, Src: Netgear_3b:4d:d2 (4c:60:de:3b:4d:d2), Dst: IntelCor_50:de:04 (00:23:15:50:de:04)
Internet Protocol Version 4, Src: 31.12.68.207 (31.12.68.207), Dst: 192.168.1.4 (192.168.1.4)
Transmission Control Protocol, Src Port: http (80), Dst Port: 49656 (49656), Seq: 69174, Ack: 1, Len: 1460
Hypertext Transfer Protocol

No.     Time           Source                Destination           Protocol Length Info
    102 4.261553000    192.168.1.4           31.12.68.207          TCP      54     49656 > http [ACK] Seq=1 Ack=72094 Win=910 Len=0

Frame 102: 54 bytes on wire (432 bits), 54 bytes captured (432 bits) on interface 0
Ethernet II, Src: IntelCor_50:de:04 (00:23:15:50:de:04), Dst: Netgear_3b:4d:d2 (4c:60:de:3b:4d:d2)
Internet Protocol Version 4, Src: 192.168.1.4 (192.168.1.4), Dst: 31.12.68.207 (31.12.68.207)
Transmission Control Protocol, Src Port: 49656 (49656), Dst Port: http (80), Seq: 1, Ack: 72094, Len: 0

No.     Time           Source                Destination           Protocol Length Info
    103 4.261752000    31.12.68.207          192.168.1.4           HTTP     690    Continuation or non-HTTP traffic

Frame 103: 690 bytes on wire (5520 bits), 690 bytes captured (5520 bits) on interface 0
Ethernet II, Src: Netgear_3b:4d:d2 (4c:60:de:3b:4d:d2), Dst: IntelCor_50:de:04 (00:23:15:50:de:04)
Internet Protocol Version 4, Src: 31.12.68.207 (31.12.68.207), Dst: 192.168.1.4 (192.168.1.4)
Transmission Control Protocol, Src Port: http (80), Dst Port: 49656 (49656), Seq: 72094, Ack: 1, Len: 636
Hypertext Transfer Protocol

No.     Time           Source                Destination           Protocol Length Info
    104 4.381218000    31.12.68.207          192.168.1.4           HTTP     1514   Continuation or non-HTTP traffic

Frame 104: 1514 bytes on wire (12112 bits), 1514 bytes captured (12112 bits) on interface 0
Ethernet II, Src: Netgear_3b:4d:d2 (4c:60:de:3b:4d:d2), Dst: IntelCor_50:de:04 (00:23:15:50:de:04)
Internet Protocol Version 4, Src: 31.12.68.207 (31.12.68.207), Dst: 192.168.1.4 (192.168.1.4)
Transmission Control Protocol, Src Port: http (80), Dst Port: 49656 (49656), Seq: 72730, Ack: 1, Len: 1460
Hypertext Transfer Protocol

No.     Time           Source                Destination           Protocol Length Info
    105 4.381270000    192.168.1.4           31.12.68.207          TCP      54     49656 > http [ACK] Seq=1 Ack=74190 Win=902 Len=0

Frame 105: 54 bytes on wire (432 bits), 54 bytes captured (432 bits) on interface 0
Ethernet II, Src: IntelCor_50:de:04 (00:23:15:50:de:04), Dst: Netgear_3b:4d:d2 (4c:60:de:3b:4d:d2)
Internet Protocol Version 4, Src: 192.168.1.4 (192.168.1.4), Dst: 31.12.68.207 (31.12.68.207)
Transmission Control Protocol, Src Port: 49656 (49656), Dst Port: http (80), Seq: 1, Ack: 74190, Len: 0

No.     Time           Source                Destination           Protocol Length Info
    106 4.479606000    31.12.68.207          192.168.1.4           HTTP     1101   Continuation or non-HTTP traffic

Frame 106: 1101 bytes on wire (8808 bits), 1101 bytes captured (8808 bits) on interface 0
Ethernet II, Src: Netgear_3b:4d:d2 (4c:60:de:3b:4d:d2), Dst: IntelCor_50:de:04 (00:23:15:50:de:04)
Internet Protocol Version 4, Src: 31.12.68.207 (31.12.68.207), Dst: 192.168.1.4 (192.168.1.4)
Transmission Control Protocol, Src Port: http (80), Dst Port: 49656 (49656), Seq: 74190, Ack: 1, Len: 1047
Hypertext Transfer Protocol

No.     Time           Source                Destination           Protocol Length Info
    107 4.526907000    31.12.68.207          192.168.1.4           HTTP     1514   Continuation or non-HTTP traffic

Frame 107: 1514 bytes on wire (12112 bits), 1514 bytes captured (12112 bits) on interface 0
Ethernet II, Src: Netgear_3b:4d:d2 (4c:60:de:3b:4d:d2), Dst: IntelCor_50:de:04 (00:23:15:50:de:04)
Internet Protocol Version 4, Src: 31.12.68.207 (31.12.68.207), Dst: 192.168.1.4 (192.168.1.4)
Transmission Control Protocol, Src Port: http (80), Dst Port: 49656 (49656), Seq: 75237, Ack: 1, Len: 1460
Hypertext Transfer Protocol

No.     Time           Source                Destination           Protocol Length Info
    108 4.526954000    192.168.1.4           31.12.68.207          TCP      54     49656 > http [ACK] Seq=1 Ack=76697 Win=892 Len=0

Frame 108: 54 bytes on wire (432 bits), 54 bytes captured (432 bits) on interface 0
Ethernet II, Src: IntelCor_50:de:04 (00:23:15:50:de:04), Dst: Netgear_3b:4d:d2 (4c:60:de:3b:4d:d2)
Internet Protocol Version 4, Src: 192.168.1.4 (192.168.1.4), Dst: 31.12.68.207 (31.12.68.207)
Transmission Control Protocol, Src Port: 49656 (49656), Dst Port: http (80), Seq: 1, Ack: 76697, Len: 0

No.     Time           Source                Destination           Protocol Length Info
    109 4.625440000    31.12.68.207          192.168.1.4           HTTP     1103   Continuation or non-HTTP traffic

Frame 109: 1103 bytes on wire (8824 bits), 1103 bytes captured (8824 bits) on interface 0
Ethernet II, Src: Netgear_3b:4d:d2 (4c:60:de:3b:4d:d2), Dst: IntelCor_50:de:04 (00:23:15:50:de:04)
Internet Protocol Version 4, Src: 31.12.68.207 (31.12.68.207), Dst: 192.168.1.4 (192.168.1.4)
Transmission Control Protocol, Src Port: http (80), Dst Port: 49656 (49656), Seq: 76697, Ack: 1, Len: 1049
Hypertext Transfer Protocol

No.     Time           Source                Destination           Protocol Length Info
    110 4.643619000    31.12.68.207          192.168.1.4           HTTP     1514   Continuation or non-HTTP traffic

Frame 110: 1514 bytes on wire (12112 bits), 1514 bytes captured (12112 bits) on interface 0
Ethernet II, Src: Netgear_3b:4d:d2 (4c:60:de:3b:4d:d2), Dst: IntelCor_50:de:04 (00:23:15:50:de:04)
Internet Protocol Version 4, Src: 31.12.68.207 (31.12.68.207), Dst: 192.168.1.4 (192.168.1.4)
Transmission Control Protocol, Src Port: http (80), Dst Port: 49656 (49656), Seq: 77746, Ack: 1, Len: 1460
Hypertext Transfer Protocol

No.     Time           Source                Destination           Protocol Length Info
    111 4.643668000    192.168.1.4           31.12.68.207          TCP      54     49656 > http [ACK] Seq=1 Ack=79206 Win=882 Len=0

Frame 111: 54 bytes on wire (432 bits), 54 bytes captured (432 bits) on interface 0
Ethernet II, Src: IntelCor_50:de:04 (00:23:15:50:de:04), Dst: Netgear_3b:4d:d2 (4c:60:de:3b:4d:d2)
Internet Protocol Version 4, Src: 192.168.1.4 (192.168.1.4), Dst: 31.12.68.207 (31.12.68.207)
Transmission Control Protocol, Src Port: 49656 (49656), Dst Port: http (80), Seq: 1, Ack: 79206, Len: 0

No.     Time           Source                Destination           Protocol Length Info
    112 4.741454000    31.12.68.207          192.168.1.4           HTTP     1102   Continuation or non-HTTP traffic

Frame 112: 1102 bytes on wire (8816 bits), 1102 bytes captured (8816 bits) on interface 0
Ethernet II, Src: Netgear_3b:4d:d2 (4c:60:de:3b:4d:d2), Dst: IntelCor_50:de:04 (00:23:15:50:de:04)
Internet Protocol Version 4, Src: 31.12.68.207 (31.12.68.207), Dst: 192.168.1.4 (192.168.1.4)
Transmission Control Protocol, Src Port: http (80), Dst Port: 49656 (49656), Seq: 79206, Ack: 1, Len: 1048
Hypertext Transfer Protocol

No.     Time           Source                Destination           Protocol Length Info
    113 4.843343000    31.12.68.207          192.168.1.4           HTTP     1514   Continuation or non-HTTP traffic

Frame 113: 1514 bytes on wire (12112 bits), 1514 bytes captured (12112 bits) on interface 0
Ethernet II, Src: Netgear_3b:4d:d2 (4c:60:de:3b:4d:d2), Dst: IntelCor_50:de:04 (00:23:15:50:de:04)
Internet Protocol Version 4, Src: 31.12.68.207 (31.12.68.207), Dst: 192.168.1.4 (192.168.1.4)
Transmission Control Protocol, Src Port: http (80), Dst Port: 49656 (49656), Seq: 80254, Ack: 1, Len: 1460
Hypertext Transfer Protocol

No.     Time           Source                Destination           Protocol Length Info
    114 4.843389000    192.168.1.4           31.12.68.207          TCP      54     49656 > http [ACK] Seq=1 Ack=81714 Win=872 Len=0

Frame 114: 54 bytes on wire (432 bits), 54 bytes captured (432 bits) on interface 0
Ethernet II, Src: IntelCor_50:de:04 (00:23:15:50:de:04), Dst: Netgear_3b:4d:d2 (4c:60:de:3b:4d:d2)
Internet Protocol Version 4, Src: 192.168.1.4 (192.168.1.4), Dst: 31.12.68.207 (31.12.68.207)
Transmission Control Protocol, Src Port: 49656 (49656), Dst Port: http (80), Seq: 1, Ack: 81714, Len: 0

No.     Time           Source                Destination           Protocol Length Info
    115 4.941566000    31.12.68.207          192.168.1.4           HTTP     1102   Continuation or non-HTTP traffic

Frame 115: 1102 bytes on wire (8816 bits), 1102 bytes captured (8816 bits) on interface 0
Ethernet II, Src: Netgear_3b:4d:d2 (4c:60:de:3b:4d:d2), Dst: IntelCor_50:de:04 (00:23:15:50:de:04)
Internet Protocol Version 4, Src: 31.12.68.207 (31.12.68.207), Dst: 192.168.1.4 (192.168.1.4)
Transmission Control Protocol, Src Port: http (80), Dst Port: 49656 (49656), Seq: 81714, Ack: 1, Len: 1048
Hypertext Transfer Protocol

No.     Time           Source                Destination           Protocol Length Info
    116 5.050026000    31.12.68.207          192.168.1.4           HTTP     1514   Continuation or non-HTTP traffic

Frame 116: 1514 bytes on wire (12112 bits), 1514 bytes captured (12112 bits) on interface 0
Ethernet II, Src: Netgear_3b:4d:d2 (4c:60:de:3b:4d:d2), Dst: IntelCor_50:de:04 (00:23:15:50:de:04)
Internet Protocol Version 4, Src: 31.12.68.207 (31.12.68.207), Dst: 192.168.1.4 (192.168.1.4)
Transmission Control Protocol, Src Port: http (80), Dst Port: 49656 (49656), Seq: 82762, Ack: 1, Len: 1460
Hypertext Transfer Protocol

No.     Time           Source                Destination           Protocol Length Info
    117 5.050087000    192.168.1.4           31.12.68.207          TCP      54     49656 > http [ACK] Seq=1 Ack=84222 Win=862 Len=0

Frame 117: 54 bytes on wire (432 bits), 54 bytes captured (432 bits) on interface 0
Ethernet II, Src: IntelCor_50:de:04 (00:23:15:50:de:04), Dst: Netgear_3b:4d:d2 (4c:60:de:3b:4d:d2)
Internet Protocol Version 4, Src: 192.168.1.4 (192.168.1.4), Dst: 31.12.68.207 (31.12.68.207)
Transmission Control Protocol, Src Port: 49656 (49656), Dst Port: http (80), Seq: 1, Ack: 84222, Len: 0

No.     Time           Source                Destination           Protocol Length Info
    118 5.147367000    31.12.68.207          192.168.1.4           HTTP     1101   Continuation or non-HTTP traffic

Frame 118: 1101 bytes on wire (8808 bits), 1101 bytes captured (8808 bits) on interface 0
Ethernet II, Src: Netgear_3b:4d:d2 (4c:60:de:3b:4d:d2), Dst: IntelCor_50:de:04 (00:23:15:50:de:04)
Internet Protocol Version 4, Src: 31.12.68.207 (31.12.68.207), Dst: 192.168.1.4 (192.168.1.4)
Transmission Control Protocol, Src Port: http (80), Dst Port: 49656 (49656), Seq: 84222, Ack: 1, Len: 1047
Hypertext Transfer Protocol
